00-00	HATUN WILLAY DERECHONCHISKUNAMANTA LLAPAN RUNAPAQ
00-01	Llapanchis runakunaq runa kayninchis derechonchiskuna kan. Llapanchispapas kaq derechoyoqllan kanchis. Manan pipas qechuwaswanchu nitaq chinkachinmanchu.
00-02	Si chay derechonchiskuna reqsisqa kanqa, qawasqa kanqa, llapanchispa, chayqa hawkalla kawsasunchis, mana maqanakuspalla, nitaq cheqninakuspalla, nitaqmi qechupanakusunchu, hawkalla kasun.
00-03	Nawpaq watakuna, manaraq derechonchis ley reqsisqa kachaqtin, chay wakin munaysapa runakuna, qari tuku runakuna, valiq tukukuna, chay derechonchiskunata sarusqaku, cheqnisqaku, mana valiqman tukuchisqaku. Hinaspa runa masinta waqachisqaku, k'umuchisqaku, cheqnisqaku, sipinankukama.
00-04	Llapan runakuna munanchis chay derechonchiskunata, ima yuyayninchistapas piensasqanchistapas rimarinanchispaq, mayqen Diostapas khuyananchispaq, allin kawsakuypi tiyananchispaq, mana pitapas manchakuspa, hawka kusisqa tiyaspa kawsananchispaq.
00-05	Chay leykunaqa amaparawasunmi, derechonchiskuna qawasqa kananpaq. Mana qawasqachu ni respetasqachu kanqa, chayqa hatariswanmi runakuna, derechonchiskunata valichiq, allin k'apaq reqsisqa kananpaq.
00-06	Llapan chay nacion llaqtakuna allin hawka kawsaylla kayta atin, ama maqanakuspalla, ama cheqninakuspalla, nitaq qechapanakuspalla yanqa qariykachaspa.
00-07	Chay hatun hununakuy "Naciones Unidas" nisqanpi niwanchis qaynata: - Kanmi derechonchiskuna. Hinaspa, kanmi runa kayninchis. Hinaspa, warmipas qaripas kaq derechoyoqllan kanchis, - nispa qelqanku documentonkupi.
00-08	Chay hatun hununakuy "Naciones Unidas" nisqanpin munan llapan runakuna chay derechonchiskunata reqsinanchista, hinaspa ruwananchista.
00-09	Llapanchis runakuna k'apaqta reqsisun qawasun yachasun chay derechonchiskunamanta, kay documentopi leyespa.
00-10	Chaymi chay willariy, chay Ieyesqanchis, imapaqcha chay derechonchiskuna kan chayta.
00-11	DERECHONCHISKUNA LEY
00-12	Hatun hununakuy "Naciones Unidas" nisqanpi qelqanku llapan runakunaq derechonkunata, allin documentopi qelqaspa, allin reqsichinakunapaq. Llapallanchis kay mundopi kaq runakuna chay derechonchiskunata reqsichinakusun, yachapachinakusun, respetachinakuspa ruwachinakusun k'apaqta.
01-00	(1) HUK KAQ
01-01	Kanmi derechonchiskuna llapanchispa, nacesqanchismanta. Kantaqmi llapanchispa runa kayninchis. Manan runa kanchu manay derechoyoq. Huk runaq derecho hukpawan kaqllan kan. Kanmi derechonchis llapanchispa allin kawsay libre tiyananchispaq. Llapan runaqpan kan yuyayninchis yachanapaq. Llapanchis kasun llapa runa masinchiskunawan munanakunapaq, huk ayllu hina.
02-00	(2) ISKAY KAQ
02-01	Kay hatun ley kamachikuyqa llapanchispaqmi, pipas kachun, mistipas, puna runapas, yuraqpas, yanapas, warmipas, qharipas. runasimilla rimaqpas, castellano rimaqpas, hanaq pacha khuyaqpas, pachamama aypakuqpas, imayna yuyaq runapas, may llaqtamantapas, mana imayoqpas, wakchapas, qhapaqpas. Anchaykunapaqmi, llapanchispaq, kay hatun ley kamachikuyqa.
02-02	(3) KIMSA KAQ
03-00	Kanmi derechonchis kawsananchispaq. Manan pipas sipiwaswanchu, nitaqmi maqawaswanchu. Kantaqmi derechonchis libre kananchispaq.
03-01	(4) TAWA KAQ
04-00	Manan pipas esclavota hina llank'achiwaswanchu, sasata, uywata hina, mana munaqtaqa.
04-01	(5) PICHQA KAQ
05-00	Manan pipas, salqa uywata hina kachispa, k 'iriwaswanchu, nitaq muchuchiwaswanchu, nitaqmi k'umuchiwaswanchu mana runata hina.
05-01	(6) SOQTA KAQ
06-00	Kanmi derechonchis juezman demandakuq rinanchispaq, juez justicia ruwawananchispaq. Manan pipas hark'awaswanchu juezman rinanchista.
06-01	(7) QANCHIS KAQ
07-00	Llapa leypaqpas llapan runapas kaqllan kanchis. Manan pipas aqilasqa kayta atinchu.
07-01	Demandanchis kaqtinqa, manan juezqa sayakunmanchu mayqenmanpas. Juezqa llapa demandanchista kaqllata uyariyta atin. Hinaspa justiciata ruwayta atin llapanchispaq, mana imanpas sayakuspa.
08-00	(8) PUSAQ KAQ
08-01	Kanmi derechonchis amparawananchispaq, derechonchista saruqtinku. Derechonchista saruqtinkuqa, amparawanchismi chay juezkunapas autoridadkunapas. K'apaqtan amparawanchis, ama kaqmanta derechonchis sarunankupaq.
09-00	(9) ESQON KAQ
09-01	Manan pipas, qasi kaqtaqqa, yanqapuni capturasqa kayta atinchu, nitaqmi carcelman wichq'asqa kayta atinchu, nitaq llaqtanmanta qarqosqa kayta atinchu.
10-00	(10) CHUNKA KAQ
10-01	Demandanchis kaqtin, otaq cargochasqa kaqtinchis, kanmi derechonchis juezpapi willakunanchispaq. Juezqa iman kaqllata uyariyta atin, mana pimanpas sayakuspalla, nitaqmi pakallanta ruwanmanchu, llaqtaq qayllanpi ruwayta atin.
11-00	(11) CHUNKA HUKNIYOQ KAQ
11-00	Cargochasqa kaqtinchisqa, manan juezqa - Huchayoq kanki, - niwaswanchu, leyman hina manaraq yachaspa cheqaychus o manachus huchanchis kan chayta tarispa.
11-01	Noqanchis imatapas ruwaqtinchis, manaraq chay ley t'aqtakamuchaqtin, manan chay ley huchachawaswanchu castigawananchispaq.
12-00	(12) CHUNKA ISKAYNIYOQ KAQ
12-01	Manan pipas, qasi kaqtaqa, yanqapuni turiyamuwaswanchu, ni ayllunchistapas, nitaq wasinchistapas, nitaq cartanchistapas. Manan pipas yanqapuni k'amiwaswanchu, nitaq huchachawaswanchu tumpaspa, nitaq runa kayninchista qepachiwaswanchu. Chaykunamantan ley amparawanchis.
13-00	(13) CHUNKA KIMSAYOQ KAQ
13-00	Kanmi derechonchis libre purikunanchispaq maymanpas. Kantaqmi derechonchis maypipas tiyakunanchispaq, munasqanchisman hina.
13-01	Kanmi derechonchis Peru llaqtanchismanta lloqsinanchispaq, qepakama kaqmanta Peru llaqtanchisman kutimpunapaq, munasqanchisman hina.
14-00	(14) CHUNKA TAWAYOQ KAQ
14-00	Kan mi derechonchis llaqtanchispi nishuta nak'arichiwaqtinchis qatiykachaspapas, huk llaqtamanpas lloqsinanchispaq, hinaspa hawka tiyananchispaq.
14-01	[Missing?]
15-00	(15) CHUNKA PICHQAYOQ KAQ
15-00	Kanmi derechonchis llapanchispa nacionniyoq kananchispaq, noqanchischu Peruano kanchis chay hina kanapaq.
15-01	Kantaqmi derechonchis nacionninchismanta lloqsispaqa hu~k nacionniyoq kanapaq.
16-00	(16) CHUNKA SOQTAYOQ KAQ
16-00	Kanmi derechonchis, winayta ushaspa, llank'ayta yachaspa, kasarakunanchispaq, chaymanta wawakunayoq aylluyoq kananchispaq. Kasarakuswan piwanpas, munasqanchisman hina, ima rikuqwanpas, yuraqwanpas, yanawanpas, may llaqtayoqwanpas, ima Dios khuyaqwanpas. Hinaspataqmi warmipas qaripas kaq derechoyoqllan kanchis.
16-01	Qaripas warmipas mayqenpas mana munaspanqa, manan kasarakunmanchu, nitaq pipas obliganmanchu, - Kasaray, - nispa, mana munaqtaqa.
16-02	Chay tayta mama llapa wawankunayoqta estadoqa sumaqta yanapayta atin, huk tayta hinalla.
17-00	(17) CHUNKA QANCHISNIYOQ KAQ
17-00	Kanmi derechonchis kaqninchiskunayoq kanapaq, kantaqmi derechonchis hayk'a runapas kuska kaqniyoq kaspa kaqninchis kananpaq.
17-01	Manan pipas, qasi kaqniyoqtaqa, yanqapuni kaqninchiskunataqa qechuwaswanchu.
18-00	(18) CHUNKA PUSAQNIYOQ KAQ
18-01	Kanmi derechonchis imaynatapas, yuyayninchisman hina, piensananchispaq, hinaspa imayna piensasqanchisman hina kawsanapaq, hinaspa mayqen Diostapas khuyananchispaq, pacha mamatapas, hanaq pachatapas, huktapas. Kantaqmi derechonchis, sapallanchis otaq hayk 'apas runakuna kuska, hununakuspa kaspanchis, mayqen Diostapas adorananchispaq, kasunanchispaq, manakunanchispaq, mayqen Diosmantapas yachachinanchispaq, mana pi tapas manchakuspa, sut 'inta ruwaspa.
19-00	(19) CHUNKA ESQONNIYOQ KAQ
19-01	Kanmi derechonchis imaynatapas yuyayninchispi piensananchispaq, hinaspa chay piensasqanchiskunata rimarinanchispaq, ama pitapas manchapakuspa, nitaq pipas hark'awaswanchu. Kantaqmi derechonchis piensasqanchista rimarinanchispaq periodicopi qelqachispapas, radiopipas, televisionpipas, may llaqtapipas kaspanchis.
20-00	(20) ISKAY CHUNKA KAQ
20-00	Kanmi derechonchis hununakunanchispaq, asambleapi hina, rimanakunanchispaq. Kantaqmi derechonchis asociacionta cooperativata ruwananchispaq.
20-01	Manataqmi pipas yaykuchiwaswanchu ima asociacionmanpas, mana munaqtaqa.
21-00	(21) ISKAY CHUNKA HUKNIYOQ KAQ
21-00	Kanmi derechonchis llaqta kamachiq kananchispaq, otaq votacionpi llaqta kamachiqta akllananchispaq. Llapanchis llaqta kamachiyman yaykuyta atinchis, llaqtaq akllasqan kaspa.
21-01	Manan pipas llaqta kamachiyman yaykunmanchu, mana akllasqa kaspaqa.
21-02	Akllasun votacionpi, munasqanchisman votaspa. Manataqmi pipas obligawaswanchu, -Hukllaman sayasun, - nispa.
22-00	(22) ISKAY CHUNKA ISKAYNIYOQ KAQ
22-01	Kanmi derechonchis estadoqa yanapawananchispaq allin kawsaypi, allin taqyasqa, tukuyniyoq tiyanapaq, ama uywa hina kanapaq.
23-00	(23) ISKAY CHUNKA KIMSAYOQ KAQ
23-00	Kanmi derechonchis llank'ananchispaq ima llank'aypipas mayqen llank'aypas akllakunanchispaq, hinaspa mana llank'ayta tariqtinchistaq, estado yanapawananchispaq.
23-01	Kanmi derechonchis, chay llank'asqanchisman hina, kaqlla pagopas chaskinanchispaq, mana pimanpas llallichastin.
23-02	Llapan llank'aqpan kan derechonchis, llank'asqanchisman hina, allin pago chaskinapaq, familianchispas allin kawsaypi kananpaq, allin sumpayta chay pago aypananpaq.
23-03	Kanmi derechonchis llank'aq masinchiskunawan hununakunanchispaq, hinaspa ima derechonchistapas manakuspa valechikunanchispaq.
24-00	(24) ISKAY CHUNKA TAWAYOQ KAQ
24-01	Kanmi derechonchis ilank'aspa samananchispaq, samariq hina kusikunanchispaq, ima pukilaypipas. Manan chay llank'achiqpas ruwachiwaswanchu nishu unayta mana samarichistin. Kantaqmi derechonchis wakin samariy p'unchawkunapas, hatun p'unchawkunapas, ganananchispaq.
25-00	(25) ISKAY CHUNKA PICHQAYOQ KAQ
25-00	Kanmi derechonchis allin kusi kawsaypi kananchispaq, mikunanchis p'achanchis mana qesawananchispaq, wasinchis kananpaq, onqoqtinchis hampichiwananchispaq. Kantaqmi derechonchis pipas estadopas yanapawananchispaq, mana llank'aykuna kaqtinpas, onqoqtinchispas, manana llank'ayta atiqtinchispas, machuyaqtinchis0napas, qarinchis warminchis wanuqtinpas, ima llakipina kaqtinchispas. Hinaspa wachakuq warmikunapas wawakunapas derechonchis kan qawasqa yanapasqa kananpaq.
25-01	Hinaspataqmi kasarasqaq wawanpas mana kasarasqaq wawanwanpas kaq derechoyoqllan kanchis qawasqa yanapasqa kananpaq.
26-00	(26) ISKAY CHUNKA SOQTAYOQ KAQ
26-00	Kanmi derechonchis estudiananchispaq, hinaspa obligatorio escuela primariapi estudiananchispaq mana qolqeta pagaspalla. Kantaqmi derechonchis, allin estudiasqanchisman hina, secondariapipas, estudios superiorespipas estudiananchispaq.
26-01	Hinaspa escuelapi yachapanchis allin runa kayta. Hinaspa chay derechonchiskunata yachaspaqa khuyanakusun, may llaqtayoqna kaqtinchispas, may Diosniyoq kaspapas.
26-02	Tayta mamakuna derechoyoq kanchis.imayna laya educacionpipas wawanchiskuna educananchispaq, estadoqpipas, particularpipas, munasqanchisman hina estudiachinapaq.
27-00	(27) ISKAY CHUNKA QANCHISNIYOQ KAQ
27-00	Kanmi derechonchis allin kayta yachapaspa kananchispaq, yachayninchisman hina, fiestakunapipas kanapaq, tusupakuypi takipakuypi tocapakuypi kanapaq folklorninchisman hina huk artekunapipas kanapaq.
27-01	Hinaspa scienciaq nawpasqanman hina, llapanchis chay scienciaq ruwasqankunayoq kanapaq, mosoq hampikunapas, aparatokunapas, maquinakunapas, hukkunapas.
28-00	(28) ISKAY CHUNKA PUSAQNIYOQ KAQ
28-01	Llapa nacionkuna kuskalla ruwayta atinku, chay llapa qawasqanchis derechonchiskuna ruwaspa kanapaq.
29-00	(29) ISKAY CHUNKA ESQONNIYOQ KAQ
29-00	Llapanchispan deberninchis kan ayllupipas llaqtapipas ima comun ruwaykunapipas yanapanapaq, kay Peru llaqtapipas estadoman yanapanapaq, atiyninchisman hina.
29-01	Chay llapa ruwananchis derechonchiskunata ruwaspa, mana hukpa derechonwan qechupanakusunchu, cheqninakusunchu, saruchanakusunchu.
29-02	Mana llaqtatapas naciontapas tusnuswanchu nitaq t'uktiswanchu, chay derechonchiskunata ruwaspa.
30-00	(30) KIMSA CHUNKA
30-01	Manan pipas kay qawasqanchis derechonchiskunata qechuwaswanchu, nitaq pakawaswanchu yachananchismanta, maypi kaqtinchispas.
