00-00	TISERRIHT TAGRAGHLANT IZERFAN N WEMDAN
00-01	Imi asmussen n lhwerma i ttalasen akkw yaggalen n twachult talsawt d yizerfan n sen yemsawan, d nitni i d llsas n tlelli, taghdemt akkw d- tifrat deg wmadal (di ddunit).
00-02	Imi kra n widn nesmussun ara izerfan n wemdan d widn iheqqren s lkhwedm n lewhuch yesserfayen tamsakwit n talsa akkw d- tlilin umadal and'ara hedren u and'ara yamnen yemdanen s tlelli idg ur yelli la aserheb la lmizirya, d nettat i d asirem alayan n wemdan.
00-03	Imi tebbwi - dd nnig kra yellan ad ttuhudden izerfan n wemdan s nnidam azerfan i wakkn ur yettuherrs ara wemdan di taggara alamma yughal d amnafeg dadd temheqranit akkw d unaghur.
00-04	Imi yessefk ad tennerni tegmi d wassaghen n tmidwa d lemhibba gar yeghlanen.
00-05	Imi di lqanun izerfan n wemdan imudan n ledjnas yedduklen berrhen i tikkelt tajdidt laman n sen deg zerfan ilsasiyen n wemdan di ccherf akkw d wazal n bnadem di tugdut izerfan n tulawin d yergazen u berrhen belli qesden ad snernin aqeddem amgarwan u ad sbed'den tigwnatin timenyafin n tudert di tlelli yettimghuren.
00-06	Imi, timura yetteskin di ledjnas yedduklen lezment iman n sent ad myallent (ad mmawanent) i wakken ad demnent nitenti d-tuddsa n ledjnas yedduklen, di mkull timura leqder aheqqani izerfan n wemdan akkw tlella tilsasiyin.
00-07	Imi afham amechruk n tlella d yizerfan agi degs lqima tameqwrant i wakken ad uqment leqder tmura leqder i lahd n sent.
00-08	Tajmait tamatawt
00-09	Tberreh belli tiserriht agi tagraghlant izerfan n wemdan d anawad amechruk igher ssaramen imudan d yeghlanen akken ma llan i wakken akkw yemdanen d yaggaln n temgarwa i glan (i ges an) dima tiserriht agi di lbal n sen, ad skhedmen akkw lmedjhud n sen, s leqraya d ttrebga i wakkn ad senernin aqader n tlella d yizerfan agi u ad demnen s ttawilat idd iteddun s laqel, (wa deffir wa) deg wennar aghelnaw d ugraghlan asmussen d usnefdes igraghlanen iheqqaniyen gar imezdaghen n ddulat taggalin s timmad n sent nagh gar yimezdaghen n tmizar i gellan ddaw lhwekm n sent aghedman.
01-00	Tamadda 1:
01-01	Imdanen, akken ma llan ttlalen d ilelliyen msawan di lhwerma d yizerfan- ghur sen tamsakwit d laquel u yessefk ad-tili tegmatt gar asen.
02-00	Tamadda 2:
02-01	Kull yiwen ghur-s lheqq ad ighellat tilella d yizerfan idd yeddan di tserriht agi bla tarayit idd yettasen si cchetla, d llun, d ldjens d tutlait, d ddin d rray asiyasi nagh rray iden i gerzan lasl aghelnaw, tamgarwa, aila talalit nagh lihala n iden yehwa yas d argaz nagh d-tamettut.
02-02	Rnu gher-s, ur ilaq ara ad-tili trayit yebnan ghef lihala tasiyasit, taghedmawt nagh tagraghlant n tmurt nagh n temnadt ideg yezdegh wemdan yehwa yas tella tmurt agi nagh temnadt agi d- talellit nagh ddaw lewkala, nagh ur tehkim ara deg yiman is nagh ur tekmil ara tlelli ines.
03-00	Tamadda 3:
03-01	Kull amdan ghur es lheqq n tudert, tilelli d laman ghef timmad is.
04-00	Tamadda 4:
04-01	Ur ilaqar a ad yughal wemdan d akli nagh d aqeddach n wemdan iden. Tasakla d uzenzi n waklan ttuherrmen madi.
05-00	Tamadda 5:
05-01	Ur ilaqara ad yettusellet ghef umdan uaqeb nagh ssikis d- teghriwin yesnughbuyen, itekksen fell as sser.
06-00	Tamadda 6:
06-01	Ang'is yehwa yili wemdan, ghur s lheqq ad yettwag leqder i timmadit is taghedmawt.
07-00	Tamadda 7:
07-01	Akkw indamen msawan zdat lqanun u ghur sen lheqq bla afraz i wakkn atn ihudd lqanun - ghur sen irkwelli lheqq i uhuddu, akken ma llan dedd tarayit ur nwufq ara tiserriht agi.
08-00	Tamadda 8:
08-01	Kull amdan ghur-s lheqq ad ichetki i tnehkamin tighelnawin yettuk'ellfen i wakkn ad fkent lheqq dedd tnehyafin ur nettqadar ara izerfan ilsasiyen is yettak udustur d lqanun.
09-00	Tamadda 9:
09-01	Ula d yiwen ur yezmir ad yettwattef, nagh ad yettwahbes nagh ad yet twanfu s ldjur.
10-00	Tamadda 10:
10-01	Kull amdan ghur-s lheqq ad-taddi tluft is zdat tnehkamt, ainani, bla tnehyaft i wakkn ad - tseyyi ma sehhant telzimin is d yizerfan is nagh ma d-tidett wayn - idd gren fell as deg wennar n laqubat.
11-00	Tamadda 11:
11-01	Kra n win yettutehmen s ssiya ad yettwahseb d imzekki alama yettusehheh s ladel ddenb idd gren fell as, ainani, zdat tnahkamt and'ara yettwadmen akkw wayn i glaqen i uhuddu ines.
11-02	Ula d yiwen ur yettwahkam ara fell as ma yekh dem kra n ssiya yettuherrmen nagh ma iferret di kra iwudjben fell as ma yella di tallit ni ayn idd gren fell as ur ikhulfara lqanun aghelnaw nagh agraghlan, yerna laquba ur d as-dd yettak ara ad - tagwar tin is i ghekkm lqanun di tallit ideg tedra ssiya.
12-00	Tamadda 12:
12-01	Ur yezmir hedd ad yessekchem iman is s ldjur di tudert n wemdan, di twachult is; deg wekkham is, timuzniwin is nagh ad yessims lhwerma-s d nnif is; kull amdan ghur-s lheqq at ihudd lqanun si tiytiwin yechban tigi.
13-00	Tamadda 13:
13-01	Kull amdan ghur-s lheqq ad yelhu s tlelli u ad yekhtir tanezdught di tmurt is.
13-02	Kull amdan ghur-s lheqq ad yeffegh si yall tamurt ghas d - tamurt is u ma yehwa yas yezmer ad yughal ghur es.
14-00	Tamadda 14:
14-01	Ma yella yettwahres wemdan s ldjur, ghur-s lheqq ad yesdari iman is u ad ighellet lanaya n tmura iden.
14-02	Amani ur d-as-dd tebbw ara ad ighellet lheqq agi ma yella yekhdem ssiya ikhulfen lqanun amechruk nagh ayn ur nwufq ara inawaden d yimenzayen n tmura yedduklen.
15-00	Tamadda 15:
15-01	Kull amdan ghur-s lheqq i tghelna is yehwan.
15-02	Ur d-as yettwakkes i yiwen s ldjur la taghelna ines la lheqq ubeddel n tghelna.
16-00	Tamadda 16:
16-01	Mi geblegh weqchich nagh teqchicht, ghur sen lheqq ad zewdjen i wakkn ad bnum tawachult bla ma yettuqegged lheqq gi s cchetla, taghelna, nagh ddiyana msawan deg zerfen m'ara zewdjen, nad'am zewdjen nagh m'ara yefsekh zzwadj.
16-02	Ur yettili zzwady alamma s lebghi d umyeqbel ukmil n wergaz d- tmettut.
16-03	Tawachult d-tagwejdit talemmast n temgarwa, ghur-s lheqq att thudd temgarwa d ddula.
17-00	Tamadda 17:
17-01	Amdan yehwa yas wehd-es nagh d amezday ghur-s lheqq ad yekseb aila.
17-02	Yiwen ur yezmir ad yettuherrem seg waila-s.
18-00	Tamadda 18:
18-01	Kull amdan ghur-s lheqq i tlelli n tedmi, tamsakwit d ddiyana, lheqq agi tetteski deg-s tlelli ubeddel n ddiyana akkw d wayn is yettamen, wehd es nagh gar medden ainani nagh di sser, s uselmed s tegdimin, s wabad d umares n lemdaheb.
19-00	Tamadda 19:
19-01	Kull amdan ghur-s lheqq n tlelli di rray d lmenteq anda yetteski lheqq ubeggen n rray bla ma yettuchebbwel u daghen tebbwi yas-dd ad inadi, ad yettef, u ad yefser di yall tamurt isallen d- tedmiwin s yall ttawil n wentaq.
20-00	Tamadda 20:
20-01	Kull amdan ghur-s lheqq i unejma akkw d- tdukla di tifrat.
20-02	Yiwen ur yezmir ad yettuhettem i wakken ad yetteski di tdukla.
21-00	Tamadda 21:
21-01	Kull amdan ghur-s lheqq ad yetteski deg wselhuy n temsal n bailek n tmurt is, ama netta s timmad is, nagh s win yekhtar d amtil is.
21-02	Kull amdan ghur-s lheqq amm netta am wiyad ad yettef amkan di lhirfat n bailek n tmurt is.
21-03	Lirad umadan d nettat i d llsas n lhiba n lehkwem n bailek- yessefk add tban s tefrant zeddigen idg ara tteskin meddn irkwelli u ara yilin si lweqt aar wayed di tugdut d sser nagh s ttawil iden it yechban ara idemnen tilellli n tefrant.
22-00	Tamadda 22:
22-01	Kull amdan yetteskin di temgarwa ghur-s lheqq di laman amgarwan gqes den ad ikafi izerfan is isagrawen imgarwanen d yidelsanen imsefken i lhwerma d usegmi alelli n timmadit is s tejmilt n lmedjhud aghelnaw d umyalli agraghlan s wayn ara yembwafaqen netta d nnidam d lerzaq n kull tamurt.
23-00	Tamadda 23:
23-01	Kull amdan ghur-s lheqq i ikheddim ara yekhtir akkn is yehwa s cchurut n ladel imsefrahen ar'at idemmen ghef ticchumert.
23-02	Imdanen akken ma llan ghur sen lheqq bla tarayit i tjernanin yemsawan ghef ikheddimen yemsawen.
23-03	Kra n win ikheddmen ghur-s lheqq i tjernant taheqqit, timsefreht ar'as idemnen i netta d twachult is tudert iwufqen lhwerma n wemdan ara yettuk'emmlen ma yebgha lhal, s kra n ttawil iden uhuddu amgarwan.
23-04	Kull amdan ghur-s lheqq ad yessebded netta d wiyad tidukliwin ikheddamen nagh ad icharek di tdukla ara ihudden lmeslaha ines.
24-00	Tamadda 24:
24-01	Kull amdan ghur-s lheqq i rraha d- tukksa n lkhiq (d ugunfu) u ladgha di lhedd iqebbel laqel n lweqt ikheddim akkw di ttrih yettwakhelsen, si lewqt aar wayed.
25-00	Tamadda 25:
25-01	Kull amdam ghur-s lheqq i lmizan n tudert ar'at iqidden i ttmana n tsehiht is (n tezmert is), liser ines akkw d- twachult is, ladgha i isafarn n tussit, llebsa, tanezdught, adawi timezgiwin (tijmilin) timgarwiyin ilaqen, ghur-s lheqq i ttmana ma ur ikheddmara, ma yuden, ma yella d anaibu nagh d adjjal, nagh d awesran nagh kra n yimi ar d as ruhent ttawilat n tudert ma yekka-dd waya nnig tezmert is;
25-02	Tiyemmatin d yigwerdan ghur sen lheqq i tallalt (lmawna) d uhuddu ikhsusiyen. Akkw igwerdan ilulen di zzwadj nagh berra n zzwadj ghur sen lheqq yemsawan di tussra (ttmana) tamgarwant.
26-00	Tamadda 26:
26-01	Kull amdan ghur-s lheqq di leqraya ur nessefk ara fell as lekhlas ladgha leqraya tamenzut akkw d- telsasit. Leqraya tamenzut d- tamelzumt, leqraya tatiqnit d uselmed n lhirfat yessefk ad ilin d imatawen, tabburt unekchum gher tlumdiwin tunnigin (alayen) yessefk ad-tili s ladel i meddn irkwelli ghef lehsab n wakken zewren.
26-02	Ttrebga yessefk ad- tessiwed ghr usefti n timmadit d usedjhed n leqder izerfan n wemdan akkw d tlella tilsasiyin, tebbwi-dd ad- twessi ghef usefhem d umsameh d lemhibba gar tmura akken ma llant d yimudan d ddiyanat i tuttfa n lehna.
26-03	Imawlan ghur sen lheqq d imezwura ad khtiren ssenf n ttrebga ara fken i warraw n sen.
27-00	Tamadda 27:
27-01	Kull amdan ghur-s lheqq ad yetteski ma yebgha di tmeddurt tadelsant n tmurt is, ad yestummen i lfenn (tazuri) akkw d tegmi n tussna d wayen idd ttaken n lfaida.
27-02	Kull amdan ghur-s lheqq uhuddu n lfaida ines tanamkawt akkw d- tmaddawt idd yekkan seg wayn idd yesnulfa di tussna, di tmedyazt (tasekla) nagh di lfenn.
28-00	Tamadda 28:
28-01	Kull amdan ghur-s lheqq deg wennar amgarwan nagh deg wennar agraghlan i wakken ad yili nnidam yechban izerfan akkw tlella idd yeddan di tserriht agi lfaida d unawad n sen.
29-00	Tamadda 29:
29-01	Amdan ghur-s lwadjeb i wegdud idg i gemken ala deg-s kan, unerni ukmil n timmadit is.
29-02	Deg wmares izerfan is d ughellet n tlella ines, kull yiwen ur ikennu ala ddaw leqyud i gersem lqanun wehd es i wakken ad yedmen asmussen d uqader izerfan d tlella n lghir is u daghen i wakken tisutriwin tighedmawin n wedyaz d nnidam n bailek d liser amataw dit emgarwa tagdudant (tadimuqratit).
29-03	Izerfan akkw d- tlella yagi, is yehwan yili, ur zmirn ara ad ttumarsen dedd inawaden d yimenzayen, n tmura yedduklen.
30-00	Tamadda 30:
30-01	Ur telli tmadda di tserrhit agi i gzemren ad-tettwafhem d-tikchi n lheqq i ddulla, nagh i wegdud nagh i wemdan i wakkn ad khedmen kra nagh ad marsen igi i gqesden ahuddu izerfan akkw d-tlella idd yeddan deg-s.
