00-00	Die Allgemeine Erklaerung der Menschenrechte
00-01	Da die Anerkennung der angeborenen Wuerde und der gleichen und unveraeusserlichen Rechte aller Mitglieder der Gemeinschaft der Menschen die Grundlage von Freiheit, Gerechtigkeit und Frieden in der Welt bildet,
00-02	da die Nichtanerkennung und Verachtung der Menschenrechte zu Akten der Barbarei gefuehrt haben, die das Gewissen der Menschheit mit Empoerung erfuellen, und da verkuendet worden ist, dass einer Welt, in der die Menschen Rede- und Glaubensfreiheit und Freiheit von Furcht und Not geniessen, das hoechste Streben des Menschen gilt,
00-03	da es notwendig ist, die Menschenrechte durch die Herrschaft des Rechtes zu schuetzen, damit der Mensch nicht gezwungen wird, als letztes Mittel zum Aufstand gegen Tyrannei und Unterdrueckung zu greifen,
00-04	da es notwendig ist, die Entwicklung freundschaftlicher Beziehungen zwischen den Nationen zu foerdern,
00-05	da die Voelker der Vereinten Nationen in der Charta ihren Glauben an die grundlegenden Menschenrechte, an die Wuerde und den Wert der menschlichen Person und an die Gleichberechtigung von Mann und Frau erneut bekraeftigt und beschlossen haben, den sozialen Fortschritt und bessere Lebensbedingungen in groesserer Freiheit zu foerdern,
00-06	da die Mitgliedstaaten sich verpflichtet haben, in Zusammenarbeit mit den Vereinten Nationen auf die allgemeine Achtung und Einhaltung der Menschenrechte und Grundfreiheiten hinzuwirken,
00-07	da ein gemeinsames Verstaendnis dieser Rechte und Freiheiten von groesster Wichtigkeit fuer die volle Erfuellung dieser Verpflichtung ist,
00-08	verkuendet die Generalversammlung
00-09	diese Allgemeine Erklaerung der Menschenrechte als das von allen Voelkern und Nationen zu erreichende gemeinsame Ideal, damit jeder einzelne und alle Organe der Gesellschaft sich diese Erklaerung stets gegenwaertig halten und sich bemuehen, durch Unterricht und Erziehung die Achtung vor diesen Rechten und Freiheiten zu foerdern und durch fortschreitende nationale und internationale Massnahmen ihre allgemeine und tatsaechliche Anerkennung und Einhaltung durch die Bevoelkerung der Mitgliedstaaten selbst wie auch durch die Bevoelkerung der ihrer Hoheitsgewalt unterstehenden Gebiete zu gewaehrleisten.
01-00	Artikel 1
01-01	Alle Menschen sind frei und gleich an Wuerde und Rechten geboren. Sie sind mit Vernunft und Gewissen begabt und sollen einander im Geist der Bruederlichkeit begegnen.
02-00	Artikel 2
02-01	Jeder hat Anspruch auf die in dieser Erklaerung verkuendeten Rechte und Freiheiten ohne irgendeinen Unterschied, etwa nach Rasse, Hautfarbe, Geschlecht, Sprache, Religion, politischer oder sonstiger Ueberzeugung, nationaler oder sozialer Herkunft, Vermoegen, Geburt oder sonstigem Stand.
02-02	Des Weiteren darf kein Unterschied gemacht werden auf Grund der politischen, rechtlichen oder internationalen Stellung des Landes oder Gebiets, dem eine Person angehoert, gleichgueltig ob dieses unabhaengig ist, unter Treuhandschaft steht, keine Selbstregierung besitzt oder sonst in seiner Souveraenitaet eingeschraenkt ist.
03-00	Artikel 3
03-01	Jeder hat das Recht auf Leben, Freiheit und Sicherheit der Person.
04-00	Artikel 4
04-01	Niemand darf in Sklaverei oder Leibeigenschaft gehalten werden; Sklaverei und Sklavenhandel sind in allen ihren Formen verboten.
05-00	Artikel 5
05-01	Niemand darf der Folter oder grausamer, unmenschlicher oder erniedrigender Behandlung oder Strafe unterworfen werden.
06-00	Artikel 6
06-01	Jeder hat das Recht, ueberall als rechtsfaehig anerkannt zu werden.
07-00	Artikel 7
07-01	Alle Menschen sind vor dem Gesetz gleich und haben ohne Unterschied Anspruch auf gleichen Schutz durch das Gesetz. Alle haben Anspruch auf gleichen Schutz gegen jede Diskriminierung, die gegen diese Erklaerung verstoesst, und gegen jede Aufhetzung zu einer derartigen Diskriminierung.
08-00	Artikel 8
08-01	Jeder hat Anspruch auf einen wirksamen Rechtsbehelf bei den zustaendigen innerstaatlichen Gerichten gegen Handlungen, durch die seine ihm nach der Verfassung oder nach dem Gesetz zustehenden Grundrechte verletzt werden.
09-00	Artikel 9
09-01	Niemand darf willkuerlich festgenommen, in Haft gehalten oder des Landes verwiesen werden.
10-00	Artikel 10
10-01	Jeder hat bei der Feststellung seiner Rechte und Pflichten sowie bei einer gegen ihn erhobenen strafrechtlichen Beschuldigung in voller Gleichheit Anspruch auf ein gerechtes und oeffentliches Verfahren vor einem unabhaengigen und unparteiischen Gericht.
11-00	Artikel 11
11-00	Jeder, der wegen einer strafbaren Handlung beschuldigt wird, hat das Recht, als unschuldig zu gelten, solange seine Schuld nicht in einem oeffentlichen Verfahren, in dem er alle fuer seine Verteidigung notwendigen Garantien gehabt hat, gemaess dem Gesetz nachgewiesen ist.
11-01	Niemand darf wegen einer Handlung oder Unterlassung verurteilt werden, die zur Zeit ihrer Begehung nach innerstaatlichem oder internationalem Recht nicht strafbar war. Ebenso darf keine schwerere Strafe als die zum Zeitpunkt der Begehung der strafbaren Handlung angedrohte Strafe verhaengt werden.
12-00	Artikel 12
12-01	Niemand darf willkuerlichen Eingriffen in sein Privatleben, seine Familie, seine Wohnung und seinen Schriftverkehr oder Beeintraechtigungen seiner Ehre und seines Rufes ausgesetzt werden. Jeder hat Anspruch auf rechtlichen Schutz gegen solche Eingriffe oder Beeintraechtigungen.
13-00	Artikel 13
13-00	Jeder hat das Recht, sich innerhalb eines Staates frei zu bewegen und seinen Aufenthaltsort frei zu waehlen.
13-01	Jeder hat das Recht, jedes Land, einschliesslich seines eigenen, zu verlassen und in sein Land zurueckzukehren.
14-00	Artikel 14
14-00	Jeder hat das Recht, in anderen Laendern vor Verfolgung Asyl zu suchen und zu geniessen.
14-01	Dieses Recht kann nicht in Anspruch genommen werden im Falle einer Strafverfolgung, die tatsaechlich auf Grund von Verbrechen nichtpolitischer Art oder auf Grund von Handlungen erfolgt, die gegen die Ziele und Grundsaetze der Vereinten Nationen verstossen.
15-00	Artikel 15
15-00	Jeder hat das Recht auf eine Staatsangehoerigkeit.
15-01	Niemandem darf seine Staatsangehoerigkeit willkuerlich entzogen noch das Recht versagt werden, seine Staatsangehoerigkeit zu wechseln.
16-00	Artikel 16
16-00	Heiratsfaehige Frauen und Maenner haben ohne Beschraenkung auf Grund der Rasse, der Staatsangehoerigkeit oder der Religion das Recht, zu heiraten und eine Familie zu gruenden. Sie haben bei der Eheschliessung, waehrend der Ehe und bei deren Aufloesung gleiche Rechte.
16-01	Eine Ehe darf nur bei freier und uneingeschraenkter Willenseinigung der kuenftigen Ehegatten geschlossen werden.
16-02	Die Familie ist die natuerliche Grundeinheit der Gesellschaft und hat Anspruch auf Schutz durch Gesellschaft und Staat.
17-00	Artikel 17
17-00	Jeder hat das Recht, sowohl allein als auch in Gemeinschaft mit anderen Eigentum innezuhaben.
17-01	Niemand darf willkuerlich seines Eigentums beraubt werden.
18-00	Artikel 18
18-01	Jeder hat das Recht auf Gedanken-, Gewissens- und Religionsfreiheit; dieses Recht schliesst die Freiheit ein, seine Religion oder Ueberzeugung zu wechseln, sowie die Freiheit, seine Religion oder Weltanschauung allein oder in Gemeinschaft mit anderen, oeffentlich oder privat durch Lehre, Ausuebung, Gottesdienst und Kulthandlungen zu bekennen.
19-00	Artikel 19
19-01	Jeder hat das Recht auf Meinungsfreiheit und freie Meinungsaeusserung; dieses Recht schliesst die Freiheit ein, Meinungen ungehindert anzuhaengen sowie ueber Medien jeder Art und ohne Ruecksicht auf Grenzen Informationen und Gedankengut zu suchen, zu empfangen und zu verbreiten.
20-00	Artikel 20
20-00	Alle Menschen haben das Recht, sich friedlich zu versammeln und zu Vereinigungen zusammenzuschliessen.
20-01	Niemand darf gezwungen werden, einer Vereinigung anzugehoeren.
21-00	Artikel 21
21-00	Jeder hat das Recht, an der Gestaltung der oeffentlichen Angelegenheiten seines Landes unmittelbar oder durch frei gewaehlte Vertreter mitzuwirken.
21-01	Jeder hat das Recht auf gleichen Zugang zu oeffentlichen Aemtern in seinem Lande.
21-02	Der Wille des Volkes bildet die Grundlage fuer die Autoritaet der oeffentlichen Gewalt; dieser Wille muss durch regelmaessige, unverfaelschte, allgemeine und gleiche Wahlen mit geheimer Stimmabgabe oder in einem gleichwertigen freien Wahlverfahren zum Ausdruck kommen.
22-00	Artikel 22
22-01	Jeder hat als Mitglied der Gesellschaft das Recht auf soziale Sicherheit und Anspruch darauf, durch innerstaatliche Massnahmen und internationale Zusammenarbeit sowie unter Beruecksichtigung der Organisation und der Mittel jedes Staates in den Genuss der wirtschaftlichen, sozialen und kulturellen Rechte zu gelangen, die fuer seine Wuerde und die freie Entwicklung seiner Persoenlichkeit unentbehrlich sind.
23-00	Artikel 23
23-00	Jeder hat das Recht auf Arbeit, auf freie Berufswahl, auf gerechte und befriedigende Arbeitsbedingungen sowie auf Schutz vor Arbeitslosigkeit.
23-01	Jeder, ohne Unterschied, hat das Recht auf gleichen Lohn fuer gleiche Arbeit.
23-02	Jeder, der arbeitet, hat das Recht auf gerechte und befriedigende Entlohnung, die ihm und seiner Familie eine der menschlichen Wuerde entsprechende Existenz sichert, gegebenenfalls ergaenzt durch andere soziale Schutzmassnahmen.
23-03	Jeder hat das Recht, zum Schutz seiner Interessen Gewerkschaften zu bilden und solchen beizutreten.
24-00	Artikel 24
24-01	Jeder hat das Recht auf Erholung und Freizeit und insbesondere auf eine vernuenftige Begrenzung der Arbeitszeit und regelmaessigen bezahlten Urlaub.
25-00	Artikel 25
25-00	Jeder hat das Recht auf einen Lebensstandard, der seine und seiner Familie Gesundheit und Wohl gewaehrleistet, einschliesslich Nahrung, Kleidung, Wohnung, aerztlicher Versorgung und notwendiger sozialer Leistungen, sowie das Recht auf Sicherheit im Falle von Arbeitslosigkeit, Krankheit, Invaliditaet oder Verwitwung, im Alter sowie bei anderweitigem Verlust seiner Unterhaltsmittel durch unverschuldete Umstaende.
25-01	Muetter und Kinder haben Anspruch auf besondere Fuersorge und Unterstuetzung. Alle Kinder, eheliche wie aussereheliche, geniessen den gleichen sozialen Schutz.
26-00	Artikel 26
26-00	Jeder hat das Recht auf Bildung. Die Bildung ist unentgeltlich, zum mindesten der Grundschulunterricht und die grundlegende Bildung. Der Grundschulunterricht ist obligatorisch. Fach- und Berufsschulunterricht muessen allgemein verfuegbar gemacht werden und der Hochschulunterricht muss allen gleichermassen entsprechend ihren Faehigkeiten offenstehen.
26-01	Die Bildung muss auf die volle Entfaltung der menschlichen Persoenlichkeit und auf die Staerkung der Achtung vor den Menschenrechten und Grundfreiheiten gerichtet sein. Sie muss zu Verstaendnis, Toleranz und Freundschaft zwischen allen Nationen und allen rassischen oder religioesen Gruppen beitragen und der Taetigkeit der Vereinten Nationen fuer die Wahrung des Friedens foerderlich sein.
26-02	Die Eltern haben ein vorrangiges Recht, die Art der Bildung zu waehlen, die ihren Kindern zuteilwerden soll.
27-00	Artikel 27
27-00	Jeder hat das Recht, am kulturellen Leben der Gemeinschaft frei teilzunehmen, sich an den Kuensten zu erfreuen und am wissenschaftlichen Fortschritt und dessen Errungenschaften teilzuhaben.
27-01	Jeder hat das Recht auf Schutz der geistigen und materiellen Interessen, die ihm als Urheber von Werken der Wissenschaft, Literatur oder Kunst erwachsen.
28-00	Artikel 28
28-01	Jeder hat Anspruch auf eine soziale und internationale Ordnung, in der die in dieser Erklaerung verkuendeten Rechte und Freiheiten voll verwirklicht werden koennen.
29-00	Artikel 29
29-00	Jeder hat Pflichten gegenueber der Gemeinschaft, in der allein die freie und volle Entfaltung seiner Persoenlichkeit moeglich ist.
29-01	Jeder ist bei der Ausuebung seiner Rechte und Freiheiten nur den Beschraenkungen unterworfen, die das Gesetz ausschliesslich zu dem Zweck vorsieht, die Anerkennung und Achtung der Rechte und Freiheiten anderer zu sichern und den gerechten Anforderungen der Moral, der oeffentlichen Ordnung und des allgemeinen Wohles in einer demokratischen Gesellschaft zu genuegen.
29-02	Diese Rechte und Freiheiten duerfen in keinem Fall im Widerspruch zu den Zielen und Grundsaetzen der Vereinten Nationen ausgeuebt werden.
30-00	Artikel 30
30-01	Keine Bestimmung dieser Erklaerung darf dahin ausgelegt werden, dass sie fuer einen Staat, eine Gruppe oder eine Person irgendein Recht begruendet, eine Taetigkeit auszuueben oder eine Handlung zu begehen, welche die Beseitigung der in dieser Erklaerung verkuendeten Rechte und Freiheiten zum Ziel hat.
