00-00	Universele ferklearring fan de rjochten fan de minske
00-01	Yn betinken nommen dat it erkennen fan de ynherinte weardichheid en fan de gelikense en unferfrjemdbere rjochten fan alle leden fan de minskemienskip grunslach is foar de frijheid, rjochtfeardigens en frede yn 'e wrald;
00-02	Yn betinken nommen dat it oan 'e kant skowen en lytsachtsjen fan 'e rjochten fan 'e minske laat hawwe ta barbaarske dieden, dy't it gewisse fan it minskdorn faksearre hawwe en dat de komst fan in wrald der't minsken frijheid fan mieningsutering en leauwe barre mei, en hja frij weze sille fan eangst en ferlet, ferkundige is as it heechste ideaal fan elk minske;
00-03	Yn betinken nommen dat it fan it grutste belang is dat de rjochten fan de minske beskerme wurde, troch de suppremaasje fan it rjocht, dat de minske net twongen wurde mei om yn leste ynstansje syn taflecht te nimmen ta opstan tsjin tyranny en underdrukking;
00-04	Yn betinken nommen dat it fan it grutste belang is de untjouwing fan freonskiplike betrekkings tusken de naasjes fuort te sterkjen;
00-05	Yn betinken nommen dat de folken fan 'e Feriene Naasjes yn it Hanfest har betrouwen yn 'e funemintele rjochten fan 'e minske, yn de weardichheid en de wearde fan 'e minske en yn de gelikense rjochten fan manlju en froulju op 'e nij befestige hawwe, en besletten hawwe sosjale foarutgong en in hegere libbensstandert yn grutter frijheid te befoarderjen;
00-06	Yn betinken nommen dat de steaten, dy't lid binne fan 'e Feriene Naasjes plechtich tasein hawwe om yn gearwurking mei de organisaasjes fan 'e Feriene Naasjes, runom de earbied foar en it ynachtnimmen fan 'e rjochten fan 'e minske en de funemintele frijheid te befoarderjen;
00-07	Yn betinken nommen dat it fan it grutste belang is foar it folslein utfieren fan dy oerienkomst dat elkenien in goed begryp hat fan dy rjochten en frijheden;
00-08	Derom proklamearret de Algemiene Gearkomste dizze Universele Ferklearring fan de Rjochten fan de Minske as it mienskiplik troch alle folken en naasjes te berikken ideaal, mei it doel dat elk yndividu en elk orgaan fan 'e mienskip mei dizze Ferklearring hieltyd foar eagen, der nei stribje sil om troch underwiis en opfieding de earbied foar dy rjochten en frijheden te befoarderjen en troch foarutstribjende maatregels, nasjonaal en ynternasjonaal, dy rjochten algemien en echt erkenne en tapasse te litten, likegoed under de folken fan steaten dy't lid fan 'e Feriene Naasjes binne, as under de folken fan gebieten under har jurisdiksje:
01-00	Kest 1
01-01	Alle minsken wurde frij en gelyk yn weardigens en rjochten berne. Hja hawwe ferstan en gewisse meikrigen en hearre har foar inoar oer yn in geast fan bruorskip te halden en te dragen.
02-00	Kest 2
02-01	Elk hat oanspraak op alle rjochten en frijheden yn dizze Ferklearring opneamd, sunder hokker underskie ek mar lykas ras, kleur, slachte, taal, godstsjinst, politike of oare oertsjuging, nasjonaal of maatskiplik komof, eigendom, berte of oare status.
02-02	Fierder sil gjin underskie makke wurde nei politike, juridyske of ynternasjonale status fan it lan of gebiet, der't immen ta heart, likefolle as it om in unofhinklik, trust- of net selsbestjoerend gebiet giet of as der in oare beheining fan 'e suvereiniteit bestiet.
03-00	Kest 3
03-01	Elk hat rjocht op libben, frijheid en unskeinberens fan syn persoan.
04-00	Kest 4
04-01	Nimmen sil yn slavemij of hearrigens halden wurde. Slavernij en slavehannel yn elke foarm binne ferbean.
05-00	Kest 5
05-01	Nimmen sil underwurpen wurde oan folteringen, noch oan in wrede, unminslike of untearjende behanneling of bestraffing.
06-00	Kest 6
06-01	Elk hat, wer't er ek is, it rjocht om as persoan erkend te wurden foar de wet.
07-00	Kest 7
07-01	Elkenien is gelyk foar de wet en hat sunder underskied oanspraak op gelikense beskerming troch de wet. Elk hat rjocht op gelikense beskerming tsjin elke efterstelling yn striid mei dizze Ferklearring en tsjin elke oantrun ta sa'n efterstelling.
08-00	Kest 8
08-01	Elk hat rjocht op doeltreffende rjochtshelp fan foechhawwende nasjonale rjochtlike ynstansjes tsjin hanlingen dy't yn striid binne mei de grunrjochten him takend by grunwet of wet.
09-00	Kest 9
09-01	Nimmen sil underwurpen wurde oan eigenwillige arrestaasje, detinsje of ferbanning.
10-00	Kest 10
10-01	Elk foar oar hat rjocht op in earlike en iepenbiere behanling fan syn saak troch in unofhinklike en unpartidige rjochtlike ynstansje by it feststellen fan syn rjochten en ferplichtings en by it bepalen fan it grundearre wezen fan in tsjin him ynstelde strafferfolging.
11-00	Kest 11
11-00	Elk dy't foar in strafber feit ferfolge wurdt, hat der rjocht op om foar unskuldich halden te wurden oant syn skuld ut kreft fan 'e wet bewiisd wurdt yn in iepenbiere terjochtsitting der't him alle waarboargen, nedich foar syn ferdigening, by takend binne.
11-01	Nimmen sil foar skuldich halden wurde oan hokfoar strafrjochtlik fergryp ek op grun fan hokker hanling of fersom ek dat neffens nasjonaal of ynternasjonaal rjocht gjin strafrjochtlik fergryp betsjutte op it stuit dat dy hanling of dat fersom begien waard. Likemin sil in swierdere straf oplein wurde as de straf dy't fan tapassing wie op it stuit dat it strafbere feit begien waard.
12-00	Kest 12
12-01	Nimmen sil underwurpen wurde oan oarmans eigenwillich ynmingen yn syn persoanlike oangelegenheden, yn syn hushalding, syn thus of syn briefwiksel, noch ien of oare oantaasting fan syn eare of goede namme. Elk hat rjocht op beskerming troch de wet tsjin sok ymningen of oantaasten.
13-00	Kest 13
13-00	Elk hat it rjocht om him frij te ferpleatsen en te ferbliuwen binnen de grinzen fan elke steat.
13-01	Elk hat it rjocht om elk lan, syn eigen ynbegrepen, te ferlitten en yn syn lan werom te kommen.
14-00	Kest 14
14-00	Elk hat it rjocht om yn oare lannen asyl te freegjen en te hawwen tsjin ferfolging.
14-01	Op dat rjocht kin gjin berop dien wurde yn gefal fan strafferfolgings fanwegen misdriuwen fan net-politike aard of hanlings yn striid mei de doelen en begjinsels fan 'e Feriene Naasjes.
15-00	Kest 15
15-00	Elk hat rjocht op in nasjonaliteit.
15-01	Nimmen mei eigenwillich syn nasjonaliteit untnommen wurde, noch it rjocht untsein wurde fan nasjonaliteit te feroarjen.
16-00	Kest 16
16-00	Sunder ien of oare beheining op grun fan ras, nasjonaliteit of godstsjinst hawwe manlju en froulju as se de jierren derta hawwe it rjocht om te trouwen en in gesin te stichtsjen. Hja hawwe gelikense rjochten wat trouwen oanbelanget, yn har trouwen en by de untbining derfan.
16-01	In houlik kin allinne sletten wurde mei de frije en folsleine tastimming fan elk syn oare helte.
16-02	lt gesin is de natuerlike en funemintele groepsienheid fan 'e maatskippij en hat rjocht op beskerming troch de maatskippij en de steat.
17-00	Kest 17
17-00	Elk hat rjocht op eigendom, itsij allinne, itsij yn 'e mande mei oaren.
17-01	Nimmen mei samar fan syn eigendom berove wurde.
18-00	Kest 18
18-01	Elk hat rjocht op frijheid fan tinken, gewisse en godstsjinst; dat rjocht haldt teffens de frijheid yn om fan godstsjinst of oertsjuging te feroarjen, en de frijheid om of allinne of yn 'e mande mei oaren sawol yn it iepenbier as yn it partikuliere libben, foar syn godstsjinst of oertsjuging ut te kommen troch dy te underwizen, troch it praktysk tapassen, troch earetsjinst en it underhalden fan geboaden en foarskriften.
19-00	Kest 19
19-01	Elk hat rjocht op frijheid fan miening en mieningsutering. Dat rjocht haldt de frijheid yn om sunder ynminging in miening te hawwen en om troch alle middels en sunder grinzen acht te slaan, ynljochtings en tinkbylden op te spoaren, te untfangen en troch te jaan.
20-00	Kest 20
20-00	Elk hat rjocht op frijheid fan freedsume feriening en gearkomste.
20-01	Nimmen mei twongen wurde om by in feriening te hearren.
21-00	Kest 21
21-00	Elk hat it rjocht om diel te nimmen oan it bestjoer fan syn lan, streekrjocht of troch frij keazen fertsjintwurdigers.
21-01	Elk hat it rjocht om op foet fan gelikensens talitten te wurden ta de oerheidstsjinsten fan syn lan.
21-02	De wil fan it folk sil de grunslach weze fan it gesach fan it regear; dy wil sil ta utering komme yn periodike en earlike ferkiezings dy't halden wurde sille ut kreft fan algemien en lykweardich kiesrjocht en by geheime stimmings of neffens in proseduere dy't krektlikegoed boarch stiet foar de frijheid fan stimmen.
22-00	Kest 22
22-01	Elk hat as lid fan 'e mienskip rjocht op maatskiplike wissigens en hat der oanspraak op dat troch nasjonale ynspanning en ynternasjonale gearwurking, en yn oerienstimming mei de organisaasje en de helpboarnen fan 'e oanbelangjende steat, de ekonomyske, sosjale en kulturele rjochten dy 't unmisber binne foar syn weardichheid en foar it frij untploaien fan syn persoanlikheid, ferwezentlike wurde.
23-00	Kest 23
23-00	Elk hat rjocht op wurk, op frije kar fan berop, op rjochtrnjittige en geunstige arbeids-betingsten en op beskerming tsjin wurkleazens.
23-01	Elk hat, sunder ien of oare benefterstelling, rjocht op itselde lean foar itselde wurk.
23-02	Elk dy't wurk docht, hat rjocht op in rjochtfeardige en geunstige beleanning dy't him en syn hushalding in minskweardich bestean mooglik makket; dy beleanning sil sa nedich mei oare middels fan sosjale beskerming oanfolle wurde.
23-03	Elk hat it rjocht om fakferienings op te rjochtsjen en him der by oan te sluten om syn belangen te beskermjen.
24-00	Kest 24
24-01	Elk hat rjocht op rest en frije tiid, mei ynbegryp fan in ridlike beheining fan 'e arbeidstiid en periodike fakansjes mei behald fan lean.
25-00	Kest 25
25-00	Elk hat rjocht op in libbensstandert dy't heech genoch is foar de sunens en it wolwezen fan himsels en syn hushalding, derunder begrepen iten, klean, husfesting en medyske fersoarging en needsaaklike sosjale tsjinsten en rjocht op foarsjenning yn gefal fan wurkleazens, sykte, ynvaliditeit, ferstjerren fan 'e oare helte, alderdom of in oar gemis oan besteansmiddels troch omstannichheden buten syn wil.
25-01	Mern en bern hawwe rjocht op bysundere soarch en bystan. Alle bern, al of net wetlik, sille under deselde sosjale beskerming falle.
26-00	Kest 26
26-00	Elk hat rjocht op underwiis; it underwiis sil fergees weze, teminsten wat it leger en basisunderwiis oanbelanget. It leger underwiis sil ferplichte weze. Beropsunderwiis en beropsoplieding sille algemien beskikber steld wurde. Heger underwiis sil lykop iepenstean foar elk, dy't der de kapasiteiten foar hat.
26-01	It underwiis sil rjochte weze op it folut untwikkeljen fan 'e minsklike persoanlikheid en op it fersterkjen fan 'e earbied foar de rjochten fan 'e minske en de funemintele frijheden. lt sil it begryp, de ferdraachsumens en de freonskip under alle naasjes, rassen of godstsjinstige groepen befoarderje en it sil it wurk fan 'e Feriene Naasjes foar it hanthavenjen fan 'e frede stypje.
26-02	Oan de alden komt yn it foarste plak it rjocht ta de soarte fan opfieding en underwiis te kiezen dy't harren bern jun wurde sil.
27-00	Kest 27
27-00	Elk hat it rjocht yn alle frijens diel te nimmen oan it kulturele libben fan 'e mienskip, te genietsjen fan keunst en diel te hawwen oan wittenskiplike foarutgong en de fruchten derfan.
27-01	Elk hat rjocht op 'e beskerming fan geastlike en materiele belangen dy't fuortkomme ut in wittenskiplik, letterkundich of artistyk wurk dat er fuortbrocht hat.
28-00	Kest 28
28-01	Elk hat rjocht op it bestean fan sa'n maatskiplike en ynternasjonale oarder, dat de rjochten en frijheden neamd yn dizze ferklearring, der folslein yn ferwezentlike wurde kinne.
29-00	Kest 29
29-00	Elk hat plichten foar de mienskip oer; allinne der is de frije en folsleine untploaiing fan syn persoanlikheid yn mooglik.
29-01	Yn it utoefenjen fan syn rjochten en frijheden sil elk allinne mar underwurpen weze oan dy beheinings dy't by de wet feststeld binne en wol inkeld en allinne foar de unmisbere erkenning en earbiediging fan 'e rjochten en frijheden fan oaren en om te foldwaan oan de rjochtfeardige easken fan 'e moraliteit, iepenbiere oarder en it algemien wolwezen yn in demokratyske mienskip.
29-02	Dy rjochten en frijheden meie yn gjin gefal utoefene wurde yn striid mei de doelen en begjinsels fan 'e Feriene Naasjes.
30-00	Kest 30
30-01	Gjin bepaling yn dizze ferklearring sil sa utlein wurde meie, dat hokker steat, groep of persoan dan ek der ek mar ien of oar rjocht oan untliene kin om eat te undernimmen of hanlingen fan hokker aard ek te ferrjochtsjen dy't it ferneatigjen fan ien fan 'e rjochten en frijheden neamd yn dizze ferklearring, ta doel hawwe.
