00-00	MASH AINTSTI IWIAKMAU AYAMPRUMATI
00-01	Juu nunkanam aintsti ankant nuya mai metekrak warasar penker pujustin awai nuka iniuiti mash aisttiniununa yasha atantin jeatsuai.
00-02	Penker inintimsamka aintsti nekachmaujai nuya timianchau inintimtakur aintsu penkeri nuya mai metekrak warasar pujutin emesmaji, tu asamti seamji ankant umasmau aarat pasenumia, turakur ankant warasar pujusarmi ii nekamujai tusar.
00-03	Aintsti inui penkeri aneakur chicham juukmakar kirak najanar ayamprumakur, aintsnaun kajerin ainiaush nepekatatji turakur kakaram wajastatji.
00-04	Penkerka juu nunkanam warasar nuya metekrak aujmatsar pujakur eemtikji iniau nuya mash aintsti takakmau.
00-05	Aintsti iwiakmauri nuya penkeri inintimtusar yajaa nunkanmaya aints iruntraru juu takatan najanawaruiti, nuwasha aishmanjai mai metek arat tusar nuya aintsan chichaman jusaruiti ikiakartai turam maimetek ankan suritkachmau emkarat juu iwiakmaunum tusar.
00-06	Mash nunkanam chichamant sumamsaruiti iruntrar aints iruntraru nuya mash nunkanmaya aintsnau ayampruktai tusar chicham jusamuiti.
00-07	Inintimsar chicham sumamasar aintsnau nuya aintsti akan pujustin chichamramka penke shirmaiti.
00-08	JUNT IRUNTRAMU
00-09	MASH NEKAMTIKMAU AINTSU IWIAKMAURI AYAMPRUMATIRI
00-10	Mashti inintimmau jusamuka, aintsti iwiakmauri mash nunkanam pant awajjsamu ati tamawiti tu asamti ii aintsti iruntrautikia ikiakartiniutji, unuimiatiniam paant jintiamu ati tiri turakur aintstiniau. nuya itiur ankan pujustiniuit nusha mash nekamu nuya arantukmau juaktatui.ii pujamunmasha nuya yaja nunkanam.
01-00	Umiktiniun iniakmauri kichik (Articulo 1)
01-01	Penker inintimsamka mash aintsti ankan, metekrin nuya nii penkerin takakui nii akiniamunmaya tu ausamti arantukmau atinuitji mai metekrak.
02-00	Umiktiniun iniakmauri jimiar (Articulo 2)
02-01	Juu chithamnumka mash aintnau ayamprumaktin takakji warinmaksha pase inintimtunitsuk, jirkauri, niniu unuimiarmaurijaish nuya kich chichamjaish, mai metek armi tamawiti.
02-02	Nusisan achuar mash nunkanam niisha pujuiniaausha, ni juntri umirin asar, maanitiuk, kajernaitsuk, mai metek ayamprunikiar penker pujusartin ainiawai.
03-00	Umiktiniun iniakmauri kampatam (Articulo 3)
03-01	Mash aintsti takakji iniu iwiakrriauri, akan pujustin nuya penker wainkamu atiniutji
04-00	Umiktiniun iniakmauri yachintiuk (Articulo 4)
04-01	Aintsti kajerkamu nuya iniarmau pujustin atsaji nuka penker surimkamuiti.
05-00	Umiktiniun iniakmauri Uwej (Articulo 5)
05-01	Yaksha asutramu, epenmiau, nuya yajasmauwa ainin jismau achatniuitji
06-00	Umiktiniun iniakmauri Iruk (Articulo 6)
06-01	Mash aintsti iniu takakji tuwinsha paant nekamu nuya kirakmamu atiniutji
07-00	Umiktiniun iniakmauri jimiaruk (Articulo 7)
07-01	Umiktin kirakjai jismasha mash metekraitji nuya mash ayamprukmau atin yash menankichmau achatniuiti.
08-00	Umiktiniun iniakmauri mena (Articulo 8)
08-01	Mash aintsti iniu ayamprumaktin takakji juunt iruntramunam nuya ayamkar iniu ayamprumaktin kirakmamun uminiachmati.
09-00	Umiktiniun iniakmauri Ipiak (Articulo 9)
09-01	Yaksha kakarmajai achikiar jea tanishmarmaunam epenmiau nuya asutramu archatnuiti.
10-00	Umiktiniun iniakmauri maiwej (Articulo 10)
10-01	Mash aintsti iniu ayamprumaktin takakjimetekrak anturnaikiatin nuya umirnaikitin tura aintsan wari chicham akuisha penker nekarnaiya iwiaratin.
11-00	Umiktiniun iniakmauri maiwej kichik (Articulo 11)
11-00	Mash aintsti iniu takakji ayamprumaktin warinsha najanachu arinink nankamir tsanumamu akur, umiktin kirak najanamu ayamprutmaji, pant nekamu nuya penker iwiarama juakat tinia.
11-01	Umiktin kirakjai jisam warish atsau wainiatur yaksha pase umakmau atsutnuiti nuya aintsan nuna pase najanatin atsawai.
12-00	Umiktiniun iniakmauri Maiwej jipiar (Articulo 12)
12-01	Yaksha nii iwiakmaurin, nii weurijiai ni jeent pujau nuya tuwinsha pujau pase umakmau nuya aintsan kajerkamu awatramu achatnuiti nuna ayamprutmaji umiktin kirak najanmauka.
13-00	Umiktiniun iniakmauri maiwej kampatam (Articulo 13)
13-00	Juu nunkanmanka mash aintsti iniu takakji ankan ii wakeramu wekasatin, irastin nuya aintsan ii pujustin wainkatin.
13-01	Mash aintsti iniutakakji yajaa nunkanam irastin, ii nunkencha nuya aintsank irasar iniu nunken waketkir pujustiniun.
14-00	Umiktiniun iniakmauri maiwej yachintiuk. (Articulo 14)
14-00	Tuwinsha turachkunka yajaa nunkanmasha uwempratin takakji aya neachmau kajerkamu nuya apapekmau akur.
14-01	Juu ayamprumamuka umiktin kirak nuya juunt iruntrau chichamen umikchata tachamuiti, antsu chicham iwiarmaman uwemtikramji.
15-00	Umiktiniun iniakmauri maiwej uwej (Articulo 15)
15-00	Mash aintsti takakji iniu pujamuri nekamu atin.
15-01	Yaksh niniu suritkamu atsui nii pujamu nunkanam nuya aintsan yajaa nunkanam pujustin.
16-00	Umiktiniun iniakmauri maiwej Irak (Articulo 16)
16-00	Uchi natsmaru nuya nuwa nawanmaru nii nuwatnaikiar pujustlnlun yaksha suritkashtiniuti, antsu niniuka nuwatnaik warasar pujustin nuya ni tsaniakmaurijai ajapnayatin nuka nii inintin ainiawai.
16-01	Antsu ninki anajmanirmaujai penker anturnainiak nuwatnaikiatin awai
16-02	li weuka arutam amasmawiti nuya shirmaiti juuiwiakmaunum tura aintsan takakji iniu ayamprukmau atin juu iwiakmaunum nuya juu nunkanam.
17-00	Umiktiniun iniakmaueri maiwej jimiairuk (Articulo 17)
17-00	Mash aintsti takakji iniu, iniuk nuya mashnau jimiastin,
17-01	Yaksha ni takakmau takustin suritkamu atsawai.
18-00	Umiktiniun iniakmauri maiwej mena (Articulo 18)
18-01	Mash aintsti iniu takakji ankan inintimratin, nuya arutam umirkatin tura aintsan iniuka awai iik yapajniatin yash tachamaitiatur ii inintimtairincha nuya arutam umirkatniunmasha turakur paant awajkitn iniuk tura mashnum nekamu arat tusar.
19-00	Umiktiniun iniakmauri maiwej ipiak (Articulo 19)
19-01	Mash aintsti iniu takakji ankan ii inintimmau nuya chichaktin nuya aintsan mash aintsti inintinmau pase ·umakmau nuya ekekar etseramu atsutnuiti.
20-00	Umiktiniun iniakmauri mai nawe (Articulo 20)
20-00	Mash aintsti iniu takakji akan iruntratin nuya shiram kawenkar chicham iwiarmau
20-01	Yash utsukchamuiti kich iruntramunam wetiniun.
21-00	Umiktiniun iniakmauri mai nawe kichik (Articulo 21)
21-00	Mash aintsti iniu takakji ii nunken juunt naamkatin nusha iruntrau chichamejai.
21-01	Mash aintsti iiniu takakji tuwisha takakmastin nusha juu nunkanam paant nekamu
21-02	Aints iruntrau kakarmarijiai juuntri naamkatin jeaji. nuu kakaram susamuakur nekas juntri atatji, tura aintsan ii inintimmau iniaikiatnuiti.
22-00	Umiktiniun iniakmauri mai nawe jimiar (Articulo 22)
22-01	Mash aintsti iniu takakji juu iwiakmaunum pujau asar penker wainkamu atin tu asamti penker wainkamu atiniutji kich iruntrarusha yainmau warasar pujustatji mash yainmau akik chichamnum, nuya penker pujustin turakur emkir wetin ii iwiakmaurin.
23-00	Umiktiniun iniakmauri mai nawe kampatam (Articulo 23)
23-00	Mash aintsti iniu takakji takakmastin wari takata wakeraji nuwi takakmakur warasar pujaji turakur takatrinchau pujatsji iiiwiakmaunum:
23-01	Mash aintsti iniu takakji, yash menankichmau mai metek akik wainkatin aji
23-02	li takakmamunam penker nuya mai metek akikmau atinuiti turakur ii weujisha warasar pujustin tura aintsan penke kakaram uyumakrinkia iruntrau yainmau aartinuitji
23-03	Mash aintsti iniu takakji iruntratin nuya iruntraunam achikiatin iniu ayamprumaktasar.
24-00	Umiktiniun iniakmauri mai nawe yachintiuk. (Articulo 24)
24-01	Mash aintsti iniu takakji ayamratin, warastin akan amaunum nuya aintsank takakmastin nuya ayampratin kintia tesarmau atiriuiti.
25-00	Umiktiniun iniakmauri mai nawe uwej (Articulo 25)
25-00	Mash aintsti iniu takakji penker pujustin ii weujai timia nekaska yurumkanam, ewejmaknum, tsuamatiniam, jea takustin nuya mashnum yainmau atinuiti tura aintsan junmasakrin, wajemawakrin nuya ii namanken pasemarakrin yainkmau atin takakji.
25-01	Nuwa wakentin nuya uchi niniun takakui penker wainkamu nuya yainmau atin nuya aintsan mash uchi niniun takuiniakui penker wainkamu atin nuatnaikiar nuya ikian pujusarakiamu akusha.
26-00	Umiktiriiun iniakmauri mai nawe iruk (Articulo 26)
26-00	Mash aints niniun takuiniakui unuimiartin tura aintsan akikmatkachmau unuimiatnumka unuimiatinuiti nuya aintsan mashnum niniun takakui uchi, natsa, juunt unuimiatiniam unuimiartiniun.
26-01	Unuimiartinka takakui nii penkerin, aintstikia unuimiakir weakur iwiarnaji ii penkerin nuamtaik aintsti arantuniktin, warutam kich aints nuya kich iruntrau irunkuish tuke. arantukmau atinuiti tura aintsar takakmakir weakur juunt nunkanmaya iruntraru yaiminiuash paant awasatatji.
26-02	liniu aparinkia niniun takakui nii wakeramunam uchirin unuiniartin
27-00	Umiktiniun iniakmauri mai nawe jimiairuk (Articulo 27)
27-00	Mash aintsti iniu takakji ii wakeramujai pujustin irutkamunam, irutkamu chichame umiakur warinmash mash yainmau atatji takat nuya unuimiartin chichamnum.
27-01	Mash aintsti iniu takakji warinmash yainmau atin, inintimmaunum nuya aintsan takatnum turasha juu takatnum unuimiartin, kirak najankatin nuya takakmati chichamnun turakur ii nurintin najanartatji.
28-00	Umiktiniun iniakmauri mai nawe mena (Articulo 28)
28-01	Mash aintsti wakeraji iniu ayamprumaktin paant nekamu ati mash nunkanam nuya yaja nunkanmasha.
29-00	Umiktiniun iniakmauri mai nawe ipiak. (Articulo 29)
29-00	Mash aintsti umiktin takakji irutkamu arantuktin ii penker tsakartiniun suramu asakui.
29-01	liniu umiakur warasar pujakrisha tuke umiktinuitji umiktin kirak najanamuka turakur paant nekamu atatji kich aintsush arantakur warasar pujustatji tura aintsaik aintsun umintikniush nuya aints iruntraush waramtikji
29-02	liniu warasar pujamuka anajmarar wari takatash najanmau atsawai antsu yaja nunkanmaya iruntraru inintimmauka aintsnau paant awajsata tamauwiti.
30-00	Umiktiniun iniakmauri kampatam nawe. (Articulo 30)
30-01	Juu takat emtikmauka pase inintimchamuiti antsu juu takatka aintsti Inlu takakmau paant awajsamu nuya arantukmau ati mash nunkanam tamauwiti.
