00-00	INKCAZO-JIKELELE NGEEMFANELO ZOLUNTU
00-01	Njengoko iimfanelo zesidima soluntu semvelo kunye neemfanelo zoluntu-jikelele olungenakunikelwa olusisisekelo senkululeko, ubulungisa noxolo emhlabeni.
00-02	Njengoko ukungananzi nokudelelwa kweemfanelo zoluntu ezingunobangela weziphumo zobukrwada ezithi zibangele ingcwangu kwisazela soluntu, kunye nesiqalo nokufika kwelizwe apho uluntu luza kuxhamla ukuthetha ngokukhululekileyo, inkolo nenkululeko engenaloyiko kunye neemfuno ezazisiweyo njengeminqweno yoluntu-jikelele.
00-03	Kwananjalo kubalulekile ke ngoko, ukuba umntu anganyanzeliswa ukufumana uncedo, okwetyeli lokugqibela, ukuchasa ubundlobongela nengcindezelo, kuba iimfanelo zesidima sobuntu mazikhuselwe ngolawulo lomthetho.
00-04	Njengokuba kubalulekile ukukhuthaza kokwandiswa kobuhlobo nemvisiswano phakathi kwezizwe.
00-05	Njengoko uluntu Lwezizwe Ezimanyeneyo luthe lwaqinisekisa kukubaluleka kweemfanelo zesidima soluntu, oku kuxabiseka kwesidima nokuxabiseka koluntu nakwiimfanelo zamadoda namakhosikazi, bathe bazimisela ukukhuthaza inkqubela yezentlalo nomgangatho obhetele kwimpilo yoluntu ekhululekileyo.
00-06	Njengoko amalungu obuRhulumente kunye nawezizwe ezimanyeneyo azimisele ukukhuthaza intlonipho yoluntu-jikelele nokuqatshelwa kweemfanelo zoluntu nokubaluleka kwenkululeko.
00-07	Njengoko iimvisiswano zesidima soluntu nenkululeko yoluntu zibalulekile ukuze kuzuzwe esi sithembiso,
00-08	NGOKU-KE NGENXA YOKO,
00-09	Intlanganiso-jikelele
00-10	Yazisa ngale nkcazo-jikelele engeemfanelo zoluntu ezikumgangatho oqhelekileyo wokuphumeza abantu bonke kunye nezizwe zonke, kude kube sekugqibeleni nokuba wonke ubani nakunye nemibutho yoluntu, ekufuneka igcine le nkcazelo, izame ukufundisa nokuqeqesha ukukhuthaza intlonipho yezomfanelo zoluntu nenkululeko, neendlela zenkqubela phambili, kwisizwe sonke nakumazwe angaphesheya ukuze kukhuseleke ummiselo-jikelele nokuqapheleka, uqwalaselo, phakathi koluntu lwamalungu oburhulumente ngokwawo, kunye nabantu bezizwe ezibaphetheyo.
01-00	Inqaku loku-1
01-01	Bonke abantu bazalwa bekhululekile belingana ngesidima nangokweemfanelo. Bonke abantu banesiphiwo sesazela nesizathu sokwenza isenzo ongathanda ukuba senziwe kumzalwane wakho.
02-00	Inqaku lesi-2
02-01	Wonke umntu unamalungelo kwiimfanelo nenkululeko eziqulathwe kule nkcazelo, ngaphandle kokwahlulwa ngobuhlanga, ibala, ubuni, ulwimi, inkolo, ezopolitiko nezinye izimvo, ezesizwe okanye ezentlalo, ezokuzalwa okanye namanye amawonga.
02-02	Ngaphezu koko, akukho mahluko unokwenziwa usekelwe kwezopolitiko, ulawulo lwezobulungisa okanye amawonga ezizwe nezizwana okanye ummandla apho umntu akhoyo, nokuba uzimele, ukuthembeka, urhulumente ongazimelanga okanye nokuba zeziphi indlela zokunciphisa ulawulo lobukumkani.
03-00	Inqaku lesi-3
03-01	Wonke umntu unelungelo lokuphila, inkululeko kunye nokhuseleko.
04-00	Inqaku lesi-4
04-01	Akukho namnye oya kugcinwa ebukhobokeni nakukhuselo lomnye umntu, kanti urhwebo ngamakhoboka aluvumelekanga nangayiphina indlela.
05-00	Inqaku lesi-5
05-01	Akukho namnye oyakuphathwa gadalala, ngenkohlakalo, ngokungenabuntu okanye ngempatho eluhlazo okanye isohlwayo.
06-00	Inqaku lesi-6
06-01	Wonke umntu unelungelo lokwamkelwa yonke indawo njengomntu phambi komthetho.
07-00	Inqaku lesi-7
07-01	Bonke abantu bayalingana phambi komthetho kwaye benamalungelo ngaphandle kocalu-calulo ngokulinganayo kukhuseleko lomthetho. Bonke abantu banelungelo lokhuselo olulinganayo oluchasene naluphina ucalu-calulo olwaphula le nkcazelo, nangokuchasene neendlela zothelekiso kucalu-calulo.
08-00	Inqaku lesi-8
08-01	Wonke umntu unelungelo loncedo lwesiphumo sobuchule benkundla yamatyala esizwe ngokomthetho owaphula iimfanelo ezibalulekileyo ezinikelwa ngumthetho wolawulo.
09-00	Inqaku le-9
09-01	Akukho namnye oza kubanjwa ngendlela engaqondakaliyo, abe libanjwa okanye abe selubhacweni.
10-00	Inqaku le-10
10-01	Wonke umntu unelungelo elipheleleyo elilinganayo nelilungileyo nokuxoxwa kwetyala esidlangalaleni yinkundla ezimeleyo okanye inkundla zamatyala ezingakhethi cala ekumisweni kwamalungelo nemfanelo zoluntu kunye naluphi na ulwaphulo mthetho amangalelwe ngalo.
11-00	Inqaku le-11
11-01	Wonke umntu omangalelwe kuba enetyala, unelungelo lokubonwa engenatyala ade abe ufunyenwe enetyala ngokwasemthethweni kwinkundla yamatyala apho ebe nesiqiniseko esifanelekileyo sokhuseleko.
11-02	Akukho namnye oya kufunyanwa enesohlwayo setyala ngenxa yomthetho okanye ukushiya isenzo esingamisa isohlwayo setyala, ngaphantsi kwamatyala esizwe nawezizwe-jikelele, nangexesha lokwenzeka kwetyala. Nakuba kubekwe isigwebo esinzima kunesiya esasisetyenziswa ngexesha lokwenzeka kwetyala.
12-00	Inqaku le-12
12-01	Akukho namnye oya kuphazanyiswa kubomi obubobakhe, kusapho lwakhe, kwikhaya lakhe okanye ngokwembalelwano, nokuba kukuhlaselwa okuhlisa isidima nodumo lomntu. Wonke umntu kufanelekile ukuba akhuselwe ngumthetho ekuphazanyisweni okanye kuhlaselo.
13-00	Inqaku le-13
13-01	Wonke umntu unelungelo lokuhamba nokuhlala phakathi kwemida yasebuRhulumenteni.
13-02	Wonke umntu unelungelo lokushiya nokuba leliphi ilizwe nelakhe ngokunjalo kwaye aphinde abuyele kwelakhe ilizwe.
14-00	Inqaku le-14
14-01	Wonke umntu unelungelo lokucela aze axhamle indawo yokhuseleko elubhacweni kwamanye amazwe.
14-02	Eli lungelo alinakukhuselwa wakumangalelwa ngenyaniso engenamvelaphi, ulwaphulo-mthetho olungenazipolitiki okanye kumthetho ochasene neenjongo zomthetho-siseko zeZizwe ezimanyeneyo.
15-00	Inqaku-15
15-01	Wonke umntu unelungelo lobuhlanga.
15-02	Akukho namnye oya kuhluthwa ubuhlanga bakhe okanye ahluthwe ilungelo lokutshintsha ubuzwe bakhe.
16-00	Inqaku le-16
16-01	Amadoda namakhosikazi aselekhulile, ngaphandle kokuthintelwa ngenxa yobuhlanga, ubuzwe okanye inkolo, banelungelo lokutshata babe nosapho. Banamalungelo alinganayo emtshatweni naxa sewuqhawukile.
16-02	Kuya kutshatwa ngokukhululekileyo nangokupheleleyo ngemvume yabo baza kuba ngumyeni nenkosikazi.
16-03	Usapho lusisisekelo esibalulekileyo sendalo kuluntu kwaye lunelungelo lokhuseleko oluvela kuluntu nakuRhulumente.
17-00	Inqaku le-17
17-01	Wonke umntu unelungelo lokuba nezinto ezizezakhe yedwa kunye nezo azidibanele nabanye.
17-02	Akukho namnye oyakuhluthwa athathelwe izinto zakhe.
18-00	Inqaku le-18
18-01	Wonke umntu unelungelo leengcinga ezikhululekileyo isazela nokholo, eli lungelo liquka inkululeko yokutshintsha ukholo lwakho okanye ukukholwa nenkululeko yoko unokukwenza wedwa okanye nobudlelwane nabanye nokuba kusesidlangalaleni okanye emfihlakalweni, ukucacisa inkolo yakho okanye ukukholelwa kwimfundiso, ukwenza unqulo nokugcina izithethe.
19-00	Inqaku le-19
19-01	Wonke umntu unelungelo lokucinga nokuthetha ngokukhululekileyo, eli lungelo liquka inkululeko yokuveza uluvo lwakhe ngaphandle kokuphazamiseka nokuzama ufumana ukuze udlulise ulwazi neengcinga nangaziphi na iintlobo zosasazo nokuba kukweyiphi na imida.
20-00	Inqaku la-20
20-01	Wonke umntu unelungelo lenkululeko yeendibano zoxolo kunye neentlanganiso zoxolo.
20-02	Akukho namnye oya kunyanzeliswa ukuba abe lilungu lentlangano.
21-00	Inqaku la-21
21-01	Wonke umntu unelungelo lokuthabatha inxaxheba kwezobuRhulumente belizwe lakhe ngqo okanye ngokusetyenziswa kwamalungu akhethiweyo.
21-02	Wonke umntu unethuba elilinganayo lokusebenzela uRhulumente welizwe lakhe.
21-03	Intando yoluntu iya kuba sisisekelo sempatho kaRhulumente; le ntando iyakubonakaliswa ngamaxesha athile nangobunyani belungelo lovoto eya kwenziwa ngokufihlakeleyo okanye ngendlela elinganayo yokuvota ngenkululeko.
22-00	Inqaku la-22
22-01	Wonke umntu njengelungu lombutho woluntu, unelungelo lokhuseleko lombutho woluntu kwaye enelungelo lokuphumeza, ngeenzame zobuzwe nangemvisiswano zamazwe nangokuvumelana nemibutho namacebo obuRhulumente ngokwezoqoqosho, ezentlalo namalungelo amasiko neemfanelo zesidima nenkululeko engenkqubela-phambili yobuntu bakhe.
23-00	Inqaku la-23
23-01	Wonke umntu unelungelo lokusebenza, ukuzikhethela umsebenzi ngokukhululekileyo, ubulungisa neemfuneko ezifanelekileyo zomsebenzi, kunye nokukhuseleka okuchasene nokungabinamsebenzi.
23-02	Wonke umntu ngaphandle komkhethe, unelungelo lomvuzo olinganayo ngomsebenzi olinganayo.
23-03	Wonke umntu osebenzayo unelungelo lobulungisa bokukhetha intlawulo ukuqinisekisa ukuba yena nosapho lwakhe baphila impilo enexabiso nesidima sobuntu, eya kuthi yongezwe kwakuba nemfuneko, ngezinye iindlela zokukhusela intlalo yoluntu.
23-04	Wonke umntu unelungelo lokubumba okanye abe lilungu lweemanyano zorhwebo, ukukhusela iimfanelo zakhe.
24-00	Inqaku la-24
24-01	Wonke umntu unelungelo lokuphumla nokuba nexesha lokuphola, kunye namaxesha avumelekileyo okusebenza namaxesha eholide ezuza umvuzo.
25-00	Inqaku la-25
25-01	Wonke umntu unelungelo lentlalo esemgangathweni ngokuphila impilo efanelekileyo kunye nosapho lwakhe, kunye nokutya, impahla, indawo yokuhlala, unyango kunye neenkonzo ezibalulekileyo zentlalo, kwanelungelo lokhuseleko wakungasebenzi, wakugula, wakuba ngumlwelwe, ngumhlolokazi, ngumdli-mhlalaphansi okanye wakuswela impilo ngokungalawulekiyo.
25-02	Ubunina nobuntwana bulungelwe yinkathalelo ebalulekileyo kunye noncedo olukhethekileyo. Bonke abantwana nakuba bengazalwa emtshatweni mabaxhamle ukhuseleko lwentlalo ngokulinganayo.
26-00	Inqaku la-26
26-01	Wonke umntu unelungelo lemfundo. Kuza kuba nomfundaze kwabaqalayo nakwimigangatho ebalulekileyo. Imfundo yabaqalayo iya kunyanzeliswa. Imfundo ngezobugcisa kunye nokufundela umsebenzi kuya kwenziwa ukuba kufumaneke kanti imfundo ephakamileyo nayo iya kwenziwa ukuba ifumaneke ngokulinganayo kuluntu lonke njengesiseko sempumelelo.
26-02	Imfundo iza kujoliswa ngqo kwinkqubela phambili epheleleyo yoluntu nokomelezwa kwentlonipho yamalungelo oluntu nokubaluleka kwenkululeko. Iza kuxhasa imvisiswano, ukunyamezelana nobuhlobo phakathi kwezizwe, ubuzwe, namaqela eenkolo eyakuthi iphuhlise umsebenzi wamazwe jikelele ukuze kugcinwe uxolo.
26-03	Abazali banelungelo elibalulekileyo lokukhetha uhlobo lwemfundo eyakuthi ifundiswe abantwana babo.
27-00	Inqaku la-27
27-01	Wonke umntu unelungelo lokuthabatha inxaxheba ngokukhululekileyo kwinkqubela yelizwe lakhe, onwabele inkcubeko kunye nesabelo senkqubela phambili yenzululwazi kunye noncedo lwezo zinto.
27-02	Wonke umntu unelungelo lokhuseleko, lwempatho kunye nezo zinto athi azithande ezithi zibe ziziphumo zezayo nayiphina inkqubela, ubuchule bokufunda nokubhala okanye ubugcisa bemveliso yombhali.
28-00	Inqaku la-28
28-01	Wonke umntu unelungelo lentlalo yoluntu kunye neyezizwe-jikelele apho amalungelo nenkuleleko alenkcazo-jikelele athi amkeleke khona.
29-00	Inqaku la-29
29-01	Wonke umntu kufuneka asebenzele uluntu aphila phakathi kwalo, apho inkululeko nenkqubela-phambili epheleleyo neyamkelekileyo yoluntu ithi ifumaneke khona.
29-02	Ekusebenziseni amalungelo nenkululeko, wonke umntu uya kuba phantsi kwempembelelo ezimiselwe ngumthetho ngezizathu zokuqinisekisa ulwamkeleko ngentlonipho yamalungelo nenkululeko yabanye, ukuhlanganiswa kweemfuneko yokuziphatha kakuhle, esidlangaleni nentlalo-ntle ngokolawulo lwedemokrasi.
29-03	La malungelo neenkululeko zoluntu mawangasetyenziswa ngendlela ephikisana neenjongo nemithetho yamazwe abumbeneyo.
30-00	Inqaku la-30
30-01	Le nkcazo-jikelele mayingatolikwa ngenjongo yokuba imele ezobuRhulumente, iqela okanye umntu owenza isithembiso okanye osenzo sineenjongo ezingatshabalalisa nokuba ngowuphi na umqathango wamalungelo kunye neenkululeko zoluntu ekuthethwa ngazo apha.
