00-00	Delaraciö' Ki' DERECHO H Ki' la' la köö jmu guue kíä guía' su'
00-01	KUU-DSU-DSA, e ti tíä dsa, ki' dsa tía kö ñi' jmí, nía asía jni siä la kö jmu guu; e sía: derecho ki' dsa, e jä má-já la juu dsa tíä' kö jmu guu.
00-02	KUU-DSU-DSA, e a s'ia dsa ñi ju o é jä' D.H. e jä la dsa nä kíä ta' a sía jmo-dsa e dsi' nía dsa kíä dsa, ma jä kö ju t'a' dsa la kua' jmu guú, a sía má gä nía roö a sïä e li goo' nía jeo dsa tä' e ja na jmo'.
00-03	KUU-DSU-DSA, e na ki D.H. ma jä ko rue jmo dsa tä', kuu juu dso' e sía e jmo dsa esa rue lu jï kä dsa tiä' juu jï na lu' dsa ta'.
00-04	KUU-DSU-DSA, y ná j'mo geé fuu ki' dsa e la juu' tíä' la kua' jmu güu e-jï á nía roö'.
00-05	KUU-DSU-DSA, la juu ñi dsa tiä la kuä' jmu guu dsa na tä gui' ñi mo-yi ki' Naciones unidas, I e' dsa, la-ju e jä e ki' D.H. ña huu ki' I' kä dsa, I kö ñi ki' hie' nía dsa ñi' I jmi jni' dsa e jä e na huu ná jmo'.
00-06	KUU-DSU-DSA, e ka-la ju estado. ti' nía teë' ñi' Naciones Unidas e-jmo – dsa i' derecho ki' tä kö jmu guu' nía.
00-07	KUU-DSU-DSA, e- kö ñi' lu D.H. e ja e na' huu ki huu ja ru to ñi mo-yi la'.
00-08	E. Asamblea General Jmo Jnia'
00-09	Juú' ki Derecho tï' la Kö jmo guu ki' D. H. e tï la júu' ní' dsa huu jä kup dsu-dsa, e é-dsa kï', nía jmo dsa í' dsa sía kö Naciö' la ma nía dsa tíä la kö' jmu guu jmo dsa e no' ti jú la' jmu tía'.
01-00	Artículo 1°
01-01	La juu dsa lu siä –Dsa kö ñi ba dsa, nía kö ni' ba na lu' dsa e dsa tï é li jnia' roö'.
02-00	Artículo 2°
02-01	La juu' dsa tï jä é, la juu' eru jua' ñi le' lá, juá ï jua dsa juá jnía a lïa' jä jnía-a. Jua h'ie' o dsa-ñi'. Jua e juá juú' gua' dsää-a; o é juú'-a. e fuü sïá-a dsa. Tía ñi. o dsa sïa kú' o jua. E-jï-e suu'.
02-02	Nia la suu, a sía jeo dsa ï tá, e joó ki político ï-a. o é vo' tï a- jua tï ï ti vo' jua ï jua jmo I', jï gua'-dsa o jua ïta' gua'-guá jmo I'.
03-00	Artículo 3°
03-01	La ju-dsa ti i síä-a, e a sïá e li jï-a- i gua h'iä dsu-a.
04-00	Artículo 4°
04-01	A, síä-dsa jmo tä ka-la I jni-o tá-lá jmo dsá tá', tu sa li jma ki'-dsa.
05-00	Artículo 5°
05-01	Jí-jua i kä' jmu, u'i', o i jma dsa la sa h'ie' i'.
06-00	Artículo 6°
06-01	La-jua dsa h'ie' jú' dso, juá-sï-dsa, a-jï' jä e sï' dsá.
07-00	Artículo 7°
07-01	Kö-ñi' ba. na kï' dsa tu ñi leé' nía kö-re' ba jmo leé I' la ju' dsa
08-00	Artículo 8°
08-01	La-ju dsa tï'-tu ñi' dsa tá', e jmá o dsa ki' dsa tu' ñi dsa 'na lu' ta h'uu la un ru ro' ñi lee'.
09-00	Artículo 9°
09-01	A síä dsá-dsa I' juu' ñi-ñí, tu a sía dsoo má ka tá' dsa nia jä i dsu-jié dsa tu u'o' suu'
10-00	Artículo 10
10-01	La ju dsa sua Derecho ki', I kö-ni' no' dsa ta juú' ki'-dsa nia i kä' dsa júu dsoó ki' dsa, ja dsa ï ta' a sía' í jma ä ï-jua-ï na jua asía dso ma ka jmo dsa'.
11-00	Artículo 11
11-00	La-ju dsá h'ie' dso, sía jú' dsoó, e-li' jua dsa, e a-sia' dsoó raä-'a, tá-la sa lu rue dsoo ki' dsa, nia I jma-ó dsa ma jä lia'-a.
11-01	A-síä dsa dso ñi' ñí, na-jua ka tä dsa ksö' dsa, e sía dsoó ma lu' lo ma ka lu' nia asía lí jmo dsa ta ña' huu ma-dsi dso ki' dsa.
12-00	Artículo 12
12-01	Asiá' dsa li jma dsiä dsa na lu' tá'-dsu juú' ki' dsa, dsa siä-kíä dsa, o-e-i sía ki' dsa o-mo gui' jie' ki' dsa o-e, ji e suu sia ki-dsa.
13-00	Artículo 13
13-00	La ju' dsa li na' tä' tää', a jï' jne dsa nía í li gua-a jï jä jne' dsa.
13-01	La ju dsa li dsoo tu su, fuu suu' o gua' vo' suu, nía e li jía' dsa h'uo' ki' na jua jne' dsá.
14-00	Artículo 14
14-00	Na-jua ja dsá uu-a, e dsa li dsu gua u'o' suu, jua-a-uu jï.
14-01	Derecho lá-e asía ki' na-jua dsa ma ka jmo dsa o e ma ka jmo dsa I sa ru tö ñi mo-guí la'.
15-00	Artículo 15
15-00	La-ju-dsa sía derecho e li' tï dsa kö naciö'.
15-01	Ji-jua ï dsa a sïä dsa e li dsa kï' e tï dsa kö naciö nía jä' e li jua-dsa e sa li kï' dsa na-jua jne e li súu naciö' ki-dsa.
16-00	Artículo 16
16-00	Dsa-ni'-nía h'ie', na-jua ma fuu' dsa; e dsa sía derecho, ki' la sa sía juú sia, jua e vo' fuu goo' dsa, o e ju gua' dsä dsa, e-jí' dsa-guo nía e jmo dsa ni ki'.
16-01	Nía e jä ba ji' dsa guó na, jua ejne ba sá ji' guo.
16-02	Kö seé' dsa, e jä, ba e jnia' ma jä ne kö fuu nía e ti dsa ñi tá' e-jmo dsa i la ju dsa tia jeé fuu'.
17-00	Artículo 17
17-00	La-ju dsa e síä derecho –e li síá ki'.
17-01	Ji-jua i dsa sa li dsuu kí e síä ki'
18-00	Artículo 18
18-01	La juu dsa h, íäá o dsa kuu', sia derecho, ka tu nía religiö e ï' dsa o e jma suu dsa religíö ki o e jä e í' dsa', nía ejma jnia dsa e jä e ï' dsa.
19-00	Artículo 19
19-01	Ka-la juu dsa sïá derecho ki' e síä e li jma dsiä dsu-dsa na-jua e jä kuu dsu dsá, na-jua e ja kuu dsu dsa é e' dsa, e jä kuu dsu-dsá.
20-00	Artículo 20
20-00	Ka-la ju' dsa e sía Derecho ki', na-jua e tíä ku siä' dsa tía' i hïa' dsuu'.
20-01	A sía ta la i jni' já sa jne dsa dsa i'.
21-00	Artículo 21
21-00	La-ju dsa e sía derecho e li jmo dsa-tá o-e li kä' dsa tä' fuu ki' dsa.
21-01	E-la juu' dsa sía derecho. E i' dsa o e jmo dsa tä' nacio' ki-dsa.
21-02	E-jua' dsa fuu e jä i jmo dsa tä', nia dsa fuu jua' e jä e li' la-jä na-juä e jna' dsa-dsa tä ñi ta'. Fuu voto e a síä dsa jue na jmo dsa. votá'.
22-00	Artículo 22
22-01	La-ju dsa tíä' kö je fuu e ti' dsa –e jma ó dsa na lu' ta' nacíö' ki' dsa, o nacíö' suu ki' dsa o li ä dsa nia kuú' sía nacío ki' dsa ma-jä' a e li' e sa' sía jï kä' dsa.
23-00	Artículo 23
23-00	La-ju dsa tï' e jno' dsa tá' i tu dsu-a e sía derecho e kó rue jmo-dsa-tá'
23-01	La-ju dsa sía derecho e rue li líä' dsa tá e jmo dsa'.
23-02	La-ju dsa jmo tá' e síá derecho ki' dsa e li lía' lo já' l jmo dsa-ejä e a sía no jmo, jí kä Familia kía dsa nía e ma, h'iä dsa ñi ta na jua na jmo jï' jï ka dsa.
23-03	La ju' dsa sñia juú' dsa i tä' dsa síndicato e li jma ki' dsá.
24-00	Artículo 24
24-01	La ju dsa sía derecho e jia' dsa kö jmu. La-kö' kö su-ma' e –asía jmo dsa ta la jï sa ma të' dsa nía e tu dsa vacacíö'
25-00	Artículo 25
25-00	La-ju dsa síá Derecho ki'-dsa e tä' dsa e a síá e na-jmo jï kä' dsa La ma-níá dsa síä kiä dsa é sa dsö'-dsa, e sá e li ku' dsa, e sía o-mu' nía la-ju e na-jmo j'I kä dsa nía la jä a sía eli' e-na.jmo', ki' dsa na-jua a sía tä' síá ki' dsa, e asíä e na-jmo' na-jua ka lu j'un' dsa o e jï' e-su. Eli' jï dsa.
25-01	Hi'e. Nía guï nía la ju si mi', e dsa jmo i' rue mi ma-jä asía e li jï dsa.; la-Ju guï lu-síä na-jï' osa' na-jï' guó së' jmi guï ko-ñii derecho sía kï guï.
26-00	Artículo 26
26-00	La ju-dsa sía derecho ki' dsa e li tu dsa guí, a síä jma mä dsa ñi tu ja dsa jnia dsa, e li tu dsa e eo guí e jnía dsa La ju guí-mí'. Na-jua jne h'uu dsa dsa jnía ñi tu a sía jua' esa li dsa jnia dsa.
26-01	E-Ja ba dsa-jnía dsa ñi tu mä-jä li-tu-dsa, ma-ja joe dsa e-ja e dsi li jmo-dsa nía ma-jä li kuu' dsa E-jä Dereco Humano, ma-ja jma ó-dsa, nía ma-jä un dsi'-dsa e jï' dsa nía dsa tíä' naciö' su' nía la ju dsa goó síä gua-uo' ma-jä jï dsá nía dsa na-kiä religiö su'. nía ma-ja ma-jnía dsa e jï tä ejmo Nacíones Unidás.
26-02	Sé'-jmi' gui-mi' e sía Dereco e jno' dsa e jä jne' dsa jma-tu gui jo dsá.
27-00	Artículo 27
27-00	La-ju dsa sía dérecho. E-i' dsa nia e li kuu' dsa e jä lu tu dsa, nia-jma tu nía jue, li kuu'. la jue dsí lí' siä.
27-01	La-ju dsa sía Derecho e jmo dsa ta i' e ti' dsa jua' e ki' Científico, mo-guí' o e jï e su.
28-00	Artículo 28
28-01	La-ju dsa sía Derecho, e ti tä dsa ñi ta. La ru-lue' Derecho y chi tö ñi declaracío ma-jä li' ti' la rutö.
29-00	Artículo 29
29-00	La-ju dsa tï' ma-ti' e jä e jmo' dsa geé' fuu uu jï jä síä dsa.
29-01	La-ju dsa, ju ï ja sa li jmo dsa eja e sa-ru jua' bu leé ki fuu goo-dsa ma-ja jmo dsa ki' Derecho, ki' Dsa suu- nia-jä jma tï lö' e ja e dsi' e a sía e sa dsi dsa-li' geé fu di' dsa.
29-02	La-ju Derecho ru tö ñi mo-gui la, a sía e li jma-suu' ha.jua a sía la jä ru-tö – o – no lue la ja juä' Nacíones Unidas.
30-00	Artículo 30
30-01	Ji-jua-e I ru-tö ñi Declaraciö la a jne jua' tu chi-ñi' Na-jua kö Estado, o kö siä' dsa o jä dsa li-jne' jmo' dsa o kï' dsa Derecho sa ru tö ñi Declaracíö la.
