00-00	dunya kishilik hoquqi xitabnamisi
00-01	insanlar ailisining barliq ezalirining özige xas izzet-hörmitini shuningdek ularning barwer we tewrenmes hoquqini etrap qilishning dunyawi erkinlik, heqqaniyet we tinchliqning asasi ikenliki.
00-02	kixilik hoquqigha étibarsiz qarash we haqaret kelturush ewj élip kixilerning wijdanini bulghaydighan yawuz zorawanliqqa aylan'ghanliqi, hemme adem söz erkinliki we étikad erkinlikidin behrimen bolidighan hemde wehime we namratliqtin xaliy bolidighan dunyaning yetip kélishi addiy xelqning aliy arzusi dep élan qilin'ghanliqi.
00-03	insanlarning ilajisizliqtin zorawanliq we zulum ustide isyan köturimiz dep tewekkulige heriket qilip yurmesliki üchün, kishilik hoquqini qanun arqiliq idare qilish yoli bilen qoghdash zörür bolghanliqi,
00-04	döletler ara dosttluq munasiwetning tereqqiyatini algha sürüsh zörürluki.
00-05	birleshken döletler teshkilatigha eza döletler xelqining birleshken döletler xartiyiside özlirining asasiy kishilik hoquqi, insaniy izzet-hörmiti we qedir-qimmiti shuningdek er-ayallarning barawerlik hoquqi toghrisidiki eqidisini qayta tekitligenliki hemde bir qeder chong erkinlik asasida jem'iyetning yuksilishi we turmush derijisining yaxshilinishini algha sürüshke bel baghlighanliqi.
00-06	eza döletlerning birleshken döletler teshkilati bilen hemkarliship, kishilik hoquqi we asasiy erkinlikning omumyuzluq hörmetlinishi we emelge qoyulushini algha sürüsh yolida qet'iy iradige kelgenliki.
00-07	ashu hoquq we erkinlikni omumyüzlük chushinishning shu qet'iy iradining toluq emelge ashurulushigha muhim tesir körsitidighanliqi.
00-08	közde tutulghachqa, hazir
00-09	yighin,
00-10	barliq xelq we barliq dölet tiriship emelge ashuridighan ortaq ölchem süpitide mushu dunya kishilik hoquqi xitabnamisini élan qilidu. her bir adem we ijtima’iy apparatning mushu xitabnamini her daim este ching saqlap, telim we terbiye arqiliq hoquq we erkinlikning hörmetlinishni tiriship algha sürüshi hemde döletlerning we xelq'araning tedrijiy ilgirilesh tedbirliri arqiliq ashu hoquq we erkinlikning eza döletlerning özidiki xelq arisida shuningdek shu döletlerning bashqurush tewelikidiki zéminida yasaydighan xelq arisida omumyüzlük we unumluk étirap qilinishi we emelge qoyulushini umid qilidu:
01-00	1-madda
01-01	hemme adem zatidinla erkin, izzet-hörmet we hoquqta babbarawer bolup tughulghan. ular eqilghe we wijdan'gha ige hemde bir-birige qérindashliq munasiwitige xas roh bilen muamile qilishi kérek.
02-00	2-madda
02-01	hemme adem mushu xitabnamide qeyt qilin'ghan barliq hoquq we erkinliktin behrimen bolush salahiyitige ige. ular irqi, renggi, jinsi, tili, dini, siyasiy qarishi yaki bashqa qarishi, dölet teweliki yaki ijtimaiy kélip chiqishi, mülki, tughulushi yaki bashqa salahiyiti jehettin qilche perqlenmeydu.
02-02	uning ustige hemme adem ozi tewe dölet yaki zéminning siyasiy, memuriy yaki xelq'ara ornining oxshash bolmasliqi bilen perqlenmeydu. Bu zéminning musteqil zémin, wakaliten bashquruluwatqan zémin. aptonomiyisiz zémin yaki bashqa herqandaq igilik hoquqigha chek qoyulghan halettiki zémin bolushidin qet'iynezer.
03-00	3-madda
03-01	hemme adem hayatliqtin, erkinliktin we jismaniy bixeterliktin behrimen bolushqa hoquqluq.
04-00	4-madda
04-01	herqandaq ademni qul qilishqa yaki qul qatarida ishlitishke bolmaydu. herqandaq shekildiki qulluq tozumnimu, qullarni élip-sétishnimu men'i qilish kérek.
05-00	5-madda
05-01	herqandaq ademni rehimsizlik bilen qiynashqa yaki wehshiy, insaniyetsiz yaki jaqaret xaraktérlik muamilige yaki jazagha duchar qilishqa bolmaydu.
06-00	6-madda
06-01	hemme adem herqandaq jayda qanun aldidiki kishilik izzitini étirap qildurushqa hoquqluq.
07-00	7-madda
07-01	hemme adem qanun aldida babbarawer hemde qilche kemsitilmey, qanunning barawer qoghdishidin behrimen bolushqa hoquqluq. Hemme adem mushu xitabnamige xilap herqandaq kemsitishtin we mushundaq kemsitishke turtke bolidighan herqandaq qilmishning ziyankeshlikdin saqlinish üchün, barawer qoghdashtin behrimen bolushqa hoquqluq.
08-00	8-madda
08-01	herqandaq adem ozining asasiy qanun yaki qanunlar bexsh etken asasiy hoquqi ziyankeshlikke uchrighanda, layaqetlik dölet soti arqiliq bundaq ziyankeshlik herikitidinunumluk qutulup qélishqa hoquqluq.
09-00	9-madda
09-01	herqandaq ademini herqandaq shekilde qolgha élishqa, nezer bent qilishqa yaki sürgün qilishqa bolmaydu.
10-00	10-madda
10-01	hemme adem musteqil hem xalis sotning adil we ochuq soraq qilish bilen özining hoquqi we mejburiyitini mueyyenleshturushke hemde özige qoyulghan herqandaq jinayi eyibni éniqliwélishqa pütünley teng hoquqluq.
11-00	11-madda
11-00	jinayi ishlar bilen erz qilin'ghanliki adem aqlash jehette lazimliq barliq kapaletke érishken ashkara sotta jinayiti barliqi qanun boyiche delillengiche gunahsiz dep qarilisqa hoquqluq.
11-01	herqandaq ademning herqandaq qilmishi yaki qilmishsizliqi sadir bolghan waqtida dölet qanuni yaki xelq'ara qanun boyiche jinayi ishlar jinayitini shekillendurmigen bolsa, jinayi ishlar jinayitini ötküzgen dep höküm chiqirishqa bolmaydu. jinayi jaza jinayet ötküzgende tetbiq qilindighan qanundiki belgilimilerdikidin éghirlitiwétilse bolmaydu.
12-00	12-madda
12-01	herqandaq ademning xususiy turmushigha, ailisige, turalghu jayigha we xet-alaqisige xalighanche arilishiwélishqa bolmaydu. Uning sheni we shöhritige hujum qilishqa bolmaydu. bundaq arilishishtin yaki hujumdin saqlinish üchün, hemme adem qanunning qoghdishidin behrimen bolushqa hoquqluq.
13-00	13-madda
13-00	hemme adem herqaysi döletlerning zéminida erkin kochushke we olturaqlishishqa hoquqluq.
13-01	hemme adem herqandaq dölettin kétishke, jomlidin öz döletidin kétishke hoquqluq hemde özining dölitige qaytip kélishke hoquqluq.
14-00	14-madda
14-00	hemme adem ziyankeshliktin saqlinish üchün, bashqa döletlerde panah tileshke we panahlinishqa hoquqluq.
14-01	heqiqeten gheyriy siyasiy jinayet yaki birleshken döletler teshkilatning asasiy meqsiti we prinsipigha xilap qilmish bilen eyiblengen ehwal astida, bundaq hoquqtin paydilinishqa bolmaydu.
15-00	15-madda
15-00	hemme adem dölet tewelikidin behrimen bolushqa hoquqluq.
15-01	herqandaq ademni dölet tewelikidin xalighanche mehrum qilishqa bolmaydu. uning dölet tewelikini özgertish hoquqini inkar qilishqimu bolmaydu.
16-00	16-madda
16-00	yash qoramigha yetken er-ayallar irq. dölet teweliki we din jehettin herqandaq cheklimige uchrimay, toylishishqa we öy tutushqa hoquqluq. Ular nikah jehette, toy qilghan mezgilde we nikah toxtimi bikar qilin'ghanda, barawer hoquqqa ige bolushi kérek.
16-01	er terep bilen ayal terepning ixtiyar qilishi we tamamen maqul bolushi arqisidila toy qilishqa bolidu.
16-02	aile tebiiy we asasiy ijtimaiy birlik, u jem'iyet we dölet terpidin qoghdilishqa tégishlik.
17-00	17-madda
17-00	hemme ademning mülükke ongche igidarliq qilish hoquqi shuningdek bashqilar bilen shérikliship igidarliq qilish hoquqi bolushi kérek.
17-01	herqandaq ademni mal-mülükidin xalighanche mehrum qilishqa bolmaydu.
18-00	18-madda
18-01	hemme adem idiyiwi, wijdaniy we diniy erkinlik hoquqigha ige: bu hoquq shu ademning özining dinini yaki étiqadini özgertish erkinlikni shuningdek özining dini yaki étiqadini diniy éqide, emeliyet, namaz-ibadet we emrimerup arqiliq yalghuz yaki öm, ashkara yaki mexpiy ipadilesh erkinlikni öz ichige alidu.
19-00	19-madda
19-01	hemme adem öz teshebbusini bildrush we pikir bayan qilish erkinlikidin behrimen bolushqa hoquqluq: bu hoquq mudaxilige uchrimay öz teshebbusini saqlap qélish erkinlikini we uchur hem pikirlerni herqandaq waste arqiliq we dölet ayrimisigha qarimay izdesh, qobul qilish we tarqitish erkinlikini öz ichige alidu.
20-00	20-madda
20-00	hemme adem tinch yol bilen yighin ötküzüsh we teshkilatlargha oyushush erkinlikidin behrimen bolushqa hoquqluq.
20-01	herqandaq ademni melum bir teshkilatning tewelikige otushke zorlashqa bolmaydu.
21-00	21-madda
21-00	hemme adem döletni idare qilishqa özi biwaste qatnishish yaki özi erkin tallighan wekili arqiliq qatnishish hoquqigha ige.
21-01	hemme adem öz dölitining hökümet ishlirigha barawer purset bilen qatnishish hoquqigha ige.
21-02	xelqning iradisi hökümet hoquqining asasi: bu irade qerellik we heqiqiy saylam bilen ipadilinishi kérek. saylam omumyüzlük we barawer awaz bérish hoquqigha asaslinishi hemde yoshurun awaz bérish yaki obdanla erkin awaz bérish boyiche élip bérilishi kérek.
22-00	22-madda
22-01	her bir adem jem'iyetning bir ezasi bolush süpiti bilen, ijtimaiy kapalettin behrimen bolushqa hoquqluq hemde özining shexsiy izzet-hörmiti we kishilik ghururining erkin rawajlinishi üchün zörür bolghan iqtisadiy, ijtimaiy jehettiki we medeniyet jehettiki her xil hoquqlardin behrimen bolushni emelge ashurushqa hoquqluq. bu emelge ashurush döletning tirishchanliqi we xelq'ara hemkarliq arqiliq hemde herqaysi döletlerning teshkilati we bayliq ehwali boyiche bolidu.
23-00	23-madda
23-00	hemme adem ishleshke, erkinkesip tallashqa, adil we muwapiq xizmet sharaitidin behrimen bolushqa hemde ishsiz qélishtin saqlinish kapalitidin behrimen bolushqa hoquqluq.
23-01	hemme adem herqandaq shekilde kemsitilmey, oxshash ish üchün oxshash heq élish hoquqigha ige.
23-02	ishligen ademning her biri adil we muwapiq heqtin behrimen bolushqa, özining we aile tawabiatining insaniy izzet-hörmetke layiq turmush sharaitigha ige bolushini kapaletke ige qilishqa, zörür tepilghanda. uninggha bashqa ijtimaiy kapaletni qoshumche qilishqa hoquqluq.
23-03	hemme adem özining menpeitini qoghdash üchün, ishchilar uyushmisini teshkillesh we uninggha qatnishish hoquqigha ige.
24-00	24-madda
24-01	hemme adem dem élish we bikar yürüsh hoquqidin, jumlidin ish waqtining chekini eqilge muwapiqlashturush hemde qerellik, maashliq dem élish hoquqidin behrimen bolidu.
25-00	25-madda
25-00	hemme adem ozining we aile tawabiatining salametliki we parawanliqini kapaletke ige qilish üchün zörür bolghan turmush sewiyisidin, jumlidin yémeklik, kiyim-kéchek, turalghu öy, dawalinishtin we zörür ijtimaiy mulazimetchiliktinbehrimen bolush hoquqigha ige: ishsiz qalghanda, késel bolup qalghanda, mejruh bolup qalghanda, tul qalghanda, qerighanda yaki tizginligili bolmaydighan bashqa ehwal bilen tirikchilik iqtidarini yoqatqanda, kapalettin behrimen bolushqa hoquqluq.
25-01	anilar we balilar alahide étibardin we yardemdin behrimen bolushqa hoquqluq. barliq balilar nikahliq yaki nikahsiz tughulghanliqigha qarimay, okhshash ijtimaiy muhapizettin behrimen bolushqa tégishlik.
26-00	26-madda
26-00	hemme adem bilim élish hoquqigha ige. bilim élish heqsiz bolushi kérek. héch bolmighanda, bashlan'ghuch we asasiy basquchta shundaq bolushi kérek. bashlanghuch ma'arip mejburiyet xaraktérida bolushi kérek. téxnika ma'aripi we kespiy ma'aripni omumyüzlük tesis qilish kérek. aliy ma'aripning ishikini netijige qarap barliq kishilerge teng echiwétish kérek.
26-01	ma'aripning meqsiti ademning xasliqini toluq yétildurush hemde kishilik hoquqi we asasiy erkinlikke bolghan hörmetni kücheytish. ma'arip herqaysi döletler, irqlar, yaki herqaysi diniy guruhlar ara chushinishni, yol qoyushni we dostluqtin ilgiri sürüshi hemde birleshken döletler teshkilatining tinchliqni qoghdash yolidiki turluk paaliyetlirini algha sürüshi kérek.
26-02	ata-anilar perzentlirining élishqa tégishlik bilim turlirini awwal tallash hoquqigha ige.
27-00	27-madda
27-00	hemme adem jem'iyetning medeniy turmushigha erkin qatniship, sen'ettin behrimen bolushqa hemde ilim-pen tereqqiyatidin we uningdin hasil bolghan parawanliqtin teng behrimen bolushqa hoquqluq.
27-01	hemme adem özi ijad qilghan ilmiy, bed'iy eserlerdin we guzel sen'et eserliridin hasil bolghan meniwi we maddiy menpe'et munasiwiti bilen, qoghdilish hoquqigha ige.
28-00	28-madda
28-01	hemme adem mushu xitabnamide qeyt qilinghan hoquq we erkinlikning toluq ré'allishishigha imkan béridighan bir xil ijtimaiy we xelq'ara tertipni telep qilishqa hoquqluq.
29-00	29-madda
29-00	hemme adem jem'iyet aldida mejburiyetni üstige alghan bolidu. chünki, ularning xasliqi jem'iyet ichidila erkin we toluq rawaj tapalaydu.
29-01	hemme adem özining hoquqi we erkinlikini yürgüzgende, qanunda belgilengen cheklimigila uchraydu. bundaq cheklimini belgileshtiki birdinbir meqset bashqilarning hoquqi we erkinlikining tégishlik derijide étirap qilinishi we hörmet qilinishigha kapaletlik qilish hemde demokratik jem'iyette exlaq. jamaet tertipi we omumiy parawanliqning orunluq éhtiyajigha layqlishish.
29-02	ashu hoquq we erkinliklerni yürgüzgende, herqandaq ehwalda birleshken döletler teshkilatning asasiy meqsiti we prinsipigha xilapliq qilishqa bolmaydu.
30-00	30-madda
30-01	bu xitabnamining herqandaq bir maddisini herqandaq dölet, guruh yaki shexs mushu xitabnamide qeyt qilinghan herqandaq hoquq we erkinlikni buzush meqsitidiki pa'aliyet yaki heriketlerni élip bérishqa hoquqluq dep sukut qilidighan menide chushendurushke bolmaydu.
