00-00	Inimõiguste ülddeklaratsioon
00-01	Pidades silmas, et inimkonna kõigi liikmete väärikuse, nende võrdsuse ning võõrandamatute õiguste tunnustamine on vabaduse, õigluse ja üldise rahu alus; ja
00-02	pidades silmas, et inimõiguste põlastamine ja hülgamine on viinud barbaarsusteni, mis piinavad inimkonna südametunnistust, ja et sellise maailma loomine, kus inimestel on veendumuste ja sõnavabadus ning kus nad ei tarvitse tunda hirmu ega puudust, on inimeste üllaks püüdluseks kuulutatud; ja
00-03	pidades silmas vajadust, et inimõigusi kaitseks seaduse võim selleks, et inimene ei oleks sunnitud viimase abinõuna üles tõusma türannia ja rõhumise vastu; ja
00-04	pidades silmas, et on vaja kaasa aidata sõbralike suhete arendamisele rahvaste vahel ja;
00-05	pidades silmas,et ühinenud rahvaste perre kuuluvad rahavad on põhikirjas kinnitanud oma usku inimese põhiõigustesse, inimisiksuse väärikusse ja väärtusse ning meeste ja naiste võrdõiguslikkusesse ning on otsustanud kaasa aidata sotsiaalsele progressile ja elutingimuste parandamisele suurema vabaduse juures; ja
00-06	pidades silmas,et liikmesriigid on kohustatud koostöös Ühinenud Rahvaste Organisatsiooniga kaasa aitama inimõiguste ja põhivabaduste üldisele austamisele ja nendest kinnipidamisele; ja
00-07	pidades silmas, et üldisel arusaamisel nende õiguste ja vajaduste iseloomust on suur tähtsus selle kohustuste täielikuks täitmiseks,
00-08	kuulutab Peaassamblee välja
00-09	käesolevaga Inimõiguste ülddeklaratsiooni kui ülesande, mida peavad püüdma täita kõik rahvad ja riigid.
00-10	Iga inimene ja iga ühiskondlik organ peab käesolevat deklaratsiooni alati silmas pidades selgitus- ja haridustööga alati kaasa aitama nende õiguste ja vabaduste austamisele ning rahvuslike ja rahvusvaheliste progressiivsete abinõudega tagama, et need õigused ja vabadused leiaksid üldist ja efektiivset tunnustamist ja täitmist nii organisatsiooni liikmeiks kui ka nende jurisdiktsiooni alla olevate territooriumide rahvaste poolt.
01-00	Artikkel 1.
01-01	Kõik inimesed sünnivad vabadena ja võrdsetena oma väärikuselt ja õigustelt. Neile on antud mõistus ja südametunnistus ja nende suhtumist üksteisesse peab kandma vendluse vaim.
02-00	Artikkel 2.
02-01	Igal inimesel peavad olema kõik käesoleva deklaratsiooniga välja kuulutatud õigused ja vabadused, olenemata rassist, nahavärvusest, soost, usulisest, poliitilisest või muudest veendumustest, rahvuslikust või sotsiaalsest päritolust, varanduslikust, seisuslikust või muust seisundist.
02-02	Lisaks sellele ei tohi inimeste vahel vahet teha riigi või territooriumi poliitilise, õigusliku või rahvusvahelise seisundi põhjal, olenemata sellest, kas territoorium, mille kodanik ollakse, on sõltumatu, hooldusalune või mõnel muul viisil oma suveräänsuses piiratud.
03-00	Artikkel 3.
03-01	Igal inimesel on õigus elule, vabadusele ja isikupuutumatusele.
04-00	Artikkel 4.
04-01	Kedagi ei või pidada orjuses või õigusteta seisundis; orjus ja orjakaubandus ükskõik millisel kujul on keelatud.
05-00	Artikkel 5.
05-01	Kellegi suhtes ei tohi rakendada piinamisi või julma, ebainimlikku, tema väärikust alandavat kohtlemist või karistust.
06-00	Artikkel 6.
06-01	Igal inimesel, ükskõik kus ta ka ei viibiks, on õigus oma õigussubjektsuse tunnustamisele.
07-00	Artikkel 7.
07-01	Kõik inimesed on seaduse ees võrdsed ja neil on ilma igasuguse vahetegemiseta õigus seaduse võrdsele kaitsele. Kõigil inimestel on õigus olla võrdselt kaitstud ükskõik missuguse diskrimineerimise eest, mis on vastuolus käesoleva deklaratsiooniga, ja sellisele diskrimineerimisele kihutamise eest.
08-00	Artikkel 8.
08-01	Igal inimesel on temale konstitutsiooniga või seadusega tagatud põhiõiguste rikkumise korral õigus efektiivsele õiguste ennistamisele kompetentsete rahvuskohtute kaudu.
09-00	Artikkel 9.
09-01	Kedagi ei või meelevaldselt vahistada, kinni pidada või pagendada.
10-00	Artikkel 10.
10-01	Igal inimesel on tema õiguste ja kohustuste määratlemiseks ja temale esitatud kriminaalsüüdistuste põhjendatuse kindlakstegemiseks täieliku võrdsuse alusel õigus sellele, et tema asi vaadataks avalikult ja kõiki õigluse nõudeid järgides läbi sõltumatu ja erapooletu kohtu poolt.
11-00	Artikkel 11.
11-00	Igal kuriteos süüdistataval inimesel on õigus sellele, et teda loetakse süütuks kuni tema süülisuse kindlakstegemiseni seaduslikus korras avalikul kohtulikul arutamisel, kus talle on tagatud kõik võimalused kaitseks.
11-01	Kedagi ei või süüdi mõista kuriteos mõne teo või tegevusetuse eest, mis nende kordasaatmise ajal ei olnud kuriteod rahvusliku seaduse või rahvusvahelise õiguse järgi. Samuti ei või määrata raskemat karistust, kui see, mida oleks võinud kohaldada kuriteo kordasaatmise ajal.
12-00	Artikkel 12.
12-01	Kellegi isiklikku ja perekonnaellu ei või meelevaldselt vahele segada, kellegi korteripuutumatust, kirjavahetuse saladust või au ja reputatsiooni ei tohi meelevaldselt määrida. Igal inimesel on õigus seaduse kaitsele selliste vahelesegamiste ja rikkumiste eest.
13-00	Artikkel 13.
13-00	Igal inimesel on õigus riigi piires vabalt liikuda ja oma elukoht valida.
13-01	Igal inimesel on õigus lahkuda ükskõik milliselt maalt, kaasa arvatud kodumaa ja kodumaale tagasi pöörduda.
14-00	Artikkel 14.
14-00	Igal inimesel on õigus tagakiusu ees varjupaika otsida teistes maades ja seda varjupaika kasutada.
14-01	Seda õigust ei saa kasutada jälitamise puhul, mis tegelikult tuleneb mittepoliitilisest kuriteost või teost, mis on vastuolus Ühinenud Rahavaste Organisatsiooni eesmärkide ja põhimõtetega.
15-00	Artikkel 15.
15-00	Igal inimesel on õigus kodakondusele.
15-01	Kelleltki ei saa tema kodakondsust või kodakondsuse muutmise õigust meelevaldselt ära võtta.
16-00	Artikkel 16.
16-00	Täisealiseks saanud meestel ja naistel on õigus ilma igasuguste kitsendusteta rassi, rahvuse või usu põhjal abielluda ja perekonda asutada. Neil on võrdsed õigused abiellu astumise suhtes, abielus olemise ja abielu lahutamise ajal.
16-01	Abielu võib sõlmida vaid mõlema abielluva poole vabatahtlikul ja täielikul nõusolekul.
16-02	Perekond on ühiskonna loomulik ja põhiline rakuke ning tal on õigus ühiskonna ja riigi kaitsele.
17-00	Artikkel 17.
17-00	Igal inimesel on õigus vara omamisele nii üksikult kui ka teistega koos.
17-01	Kelleltki ei tohi tema vara meelevaldselt ära võtta.
18-00	Artikkel 18.
18-01	Igal inimesel on õigus mõtte-, südametunnistuse ja usuvabadusele; see õigus kätkeb vabadust oma usku või veendumusi muuta, samuti vabadust vabalt kuulutuada oma usku või veendumusi nii üksikult kui ka koos teistega avalikult või eraviisiliselt õpetuse, jumalateenistuse ja religioossete ning rituaalsete kombetalituste kaudu.
19-00	Artikkel 19.
19-01	Igal inimesel on õigus veendumuste vabadusele ja nende veendumuste vabalt avaldamisele; see õigus kätkeb vabadust takistamatult oma veendumustest kinni pidada ja vabadust informatsiooni ja ideid otsida, saada ja levitada igasuguste abinõudega ja riigipiirist sõltumata.
20-00	Artikkel 20.
20-00	Igal inimesel on õigus rahumeelse kogunemise ja liitumise vabadusele.
20-01	Kedagi ei või sundida ükskõik millisesse assotsiatsiooni astuma.
21-00	Artikkel 21.
21-00	Igal inimesel on õigus kas vahetult või siis vabalt valitud esindajate kaudu oma maa valitsemisest osa võtta.
21-01	Igal inimesel on õigus võrdsele pääsule oma maa riigiteenistusse.
21-02	Valitsuse võimu aluseks peab olema rahava tahe; see tahe peab väljenduma perioodislistes ja võltsimata valimistes, mis tuleb läbi viia üldise ja võrdse valimisõiguse alusel salajase hääletamise teel või teistes samatähenduslikes vormides, mis tagavad hääletamise vabaduse.
22-00	Artikkel 22.
22-01	Igal inimesel kui ka ühiskonna liikmel on õigus sotsiaalsele kindlustatusele ja tema väärikuse säilitamiseks ning tema isiksuse vabaks arenemiseks vajalike õiguste teostamisele majanduslikul, sotsiaalsel ja kultuuri alal rahvuslike jõupingutustega ja rahvusvaheli koostöö kaudu ning vastavalt iga riigi struktuurile ja vahenditele.
23-00	Artikkel 23.
23-00	Igal inimesel on õigus tööle, töö vabale valikule, õiglastele ja soodsatele töötingimustele ning kaitsele tööpuuduse eest.
23-01	Igal inimesel on ilma igasuguse diskrimineerimiseta võrdsele tasule võrdse töö eest.
23-02	Igal töötajal on õigus õiglasele ja rahuldavale tasule, mis tagab inimväärilise elatuse temale endale ja ta perekonnale ja mida vajaduse korral täiendatakse sotsiaalkindlustuse teiste vahenditega.
23-03	Igal inimesel on õigus on luua ametühinguid ja oma huvide kaitseks ametühingutesse astuda.
24-00	Artikkel 24.
24-01	Igal inimesel on õigus puhkeajale ja vaba aja veetmisele, kaasa arvatud tööpäeva mõistlik lühendamine ja tasutav perioodiline puhkus.
25-00	Artikkel 25.
25-00	Igal inimesel on õigus sellisele elatustasemele, sealhulgas toit, riietus, korter, arstiabi ja vajalik sotsiaalne teenindamine, mis on nõutav tema enda ja perekonna tervise ja heaolu hoidmiseks, ja õigus kindlustatusele tööpuuduse, haiguse, invaliidsuse, lesestumise ja vanaduse saabumise korral või mõnel muul elatusvahenditest ilmajäämise juhul inimestest endast olenemata põhjustel.
25-01	Emadus ja väikelapseiga annavad õiguse erilisele hooldusele ja abile. Kõigile lastele, olgu nad siis sündinud abielus või väljaspool abielu, peab osaks saama ühesugune sotsiaalne kaitse.
26-00	Artikkel 26.
26-00	Igal inimesel on õigus haridusele. Haridus peab olema tasuta vähemalt alg- ja üldhariduse osas. Algharidus peab olema kohustuslik. Tehniline ja kutseharidus peab olema kättesaadav kõigile ja kõrgem haridus võrdselt kättesaadav kõigile vastavalt igaühe võimetele.
26-01	Haridus peab olema suunatud inimisiksuse täielikule arendamisele ja inimõigustest ning põhivabadustest lugupidamise suurendamisele. Haridus peab kaasa aitama vastastikusele mõistmisele, sallivusele ja sõprusele kõigi rahavaste, rassilise ja usuliste rühmituste vahel ning soodustama Ühinenud Rahvaste Organisatsiooni tegevust rahu säilitamisel.
26-02	Vanematel on oma laste hariduse valikul eesõigus.
27-00	Artikkel 27.
27-00	Igal inimesel on õigus ühiskonna kultuurielust vabalt osa võtta, kunsti nautida, teaduse progressi oma panus anda ja selle progressi hüvesid kasutada.
27-01	Igal inimesle on õigus oma moraalsete ja materiaalsete huvide kaitsele, mis johtuvad teaduslikest töödest, kunsti- ja kirjandusteostest, mille autoriks ta on.
28-00	Artikkel 28.
28-01	Igal inimesle on õigus sotsiaalsele ja rahvusvahelisele korraldusele, kus käesolevas deklaratsioonis toodud õigusi ja vabadusi on võimalik täies ulatuses rakendada.
29-00	Artikkel 29.
29-00	Igal inimesel on kohustused ühiskonna ees, kus ainuüksi ongi võimalik tema isiksuse vaba ja täielik arenemine.
29-01	Oma õiguste ja vabaduste teostamisel peab iga inimene alluma vaid sellistele piiramistele, mis on seadusega kehtestatud ainsa eesmärgiga tagada teiste inimeste õiguste ja vabaduste tarvilik tunnustamine ja austamine ning moraalist, avalikust korrast ja üldise heaolu nõuetest kinnipidamine demokraatlikus ühiskonnas.
29-02	Nende õiguste ja vabaduste rakendamine ei või mingil juhul olla vastuolus Ühinenud Rahvaste Organisatsiooni eesmärkide ja põhimõtetega.
30-00	Artikkel 30.
30-01	Käesolevas deklaratsioonis ei tohi midagi tõlgendada kui õiguse andmist mõnele riigile, isikute rühmale või üksikisikutele tegutsemiseks või tegudeks, mis on suunatud kaesolevas deklaratsioonis toodud õiguste ja vabaduste kaotamisele.
